current_position,current_company,years_of_experience,total_skills,education_degree,education_institution,certifications,city,state,country,profile_type
Software Engineer,YsecIT Softwares India Private Limited,4.9,"Redis, NestJS, TypeScript, TypeORM, Microservices, Socket.io, Jira, Git, GitHub, HTML5, OpenAI, SendGrid, Amazon S3, Third Party API Integrations - Google Calendar • Shopify • Zendesk • Gorgias • , GraphQL, Apollo GraphQL, PostgreSQL, Supabase, Mongoose ODM, Node-RED, English, Hindi, Cascading Style Sheets (CSS), HTML, C (Programming Language), C++, Python (Programming Language), Data Structures, SAPUI5, MySQL, Microsoft Office, JavaScript, Node.js, Express.js, React.js, MongoDB",Master of Computer Applications - MCA,Rajiv Gandhi Prodyogiki Vishwavidyalaya,"Back End Development and APIs, JavaScript Algorithms and Data Structures, Full Stack Development Internship Program",Bengaluru,Karnataka,India,backendFinal
Senior Software Engineer,Siemens,10.8,"REST APIs, Core Java, Windows, SQL, JavaScript, Oracle, C++, C, HTML, Microsoft Office, Java, Microsoft Word, Spring Framework, Hibernate, Struts, JSP, Servlets, JUnit, Microsoft Excel, MySQL, Microsoft SQL Server, XML, Microservices, Docker, Kubernetes, Spring Boot, Java Frameworks, Spring MVC, Spring Integration, Maven, Github, Dmaap, Docker Products, docker, kubernate, Representational State Transfer (REST), SoapUI, springBoot, Drools, Git, Jenkins, Spring Batch, JSON, Tomcat",Master’s Degree,INMANTEC,"Docker, Java Certification on Core & Advance .",Bengaluru,Karnataka,India,backendFinal
Software Engineer 1,Precisely,3.8,"SQL, C++, Java",Bachelor of Technology,Lovely Professional University,,Bengaluru,Karnataka,India,backendFinal
SDE - II,greytHR,3.1,"BIRT Project, Spring Boot, Kubernetes, Docker, Keycloak, Apache Kafka, Amazon EC2, Continuous Integration and Continuous Delivery (CI/CD), Jenkins, TypeORM, gRPC, NestJS, TypeScript, Node.js, IntelliJ IDEA, Apollo GraphQL, GraphQL, Linux Kernel, Spring web , Hibernate, PostgreSQL, Microservices, Spring MVC, REST APIs, Spring Security, Java Database Connectivity (JDBC), Spring Framework, JavaScript, Manual Testing, Core Java, Object-Oriented Programming (OOP), Data Structures, Cascading Style Sheets (CSS), HTML, SQL",Bachelor of Technology - BTech,"Sharnbasva University, Kalaburagi",,Bengaluru,Karnataka,India,backendFinal
SDE 3,Meesho,8.6,"Elasticsearch, MongoDB, Apache Flink, HBase, Java, Microservices, Distributed Systems, Algorithms, Data Structures, Object-Oriented Programming (OOP), Programming, RESTful WebServices, Spring Boot, Amazon Web Services (AWS), MySQL, Maven, C++, SQL, GitHub, Problem Solving, Cassandra, Apache Kafka, Redis",Bachelor's degree,Lovely Professional University,android developer,Bengaluru,Karnataka,India,backendFinal
SDE 2,ZopSmart,3.3,Go (Programming Language),Bachelor of Engineering - BE,Chitkara University,"CSS, JavaScript (Basic), Programming in java, Introduction to Cyber Security, Java for Android, EFSET English Certificate 62/100 (C1 Advanced), Introduction to Web Development",Bengaluru,Karnataka,India,backendFinal
Software Engineer,HackerEarth,5.7,"REST APIs, Database Design, Microservices, Audio Processing, Distributed Systems, GenAI, Prompt Engineering, Rust (Programming Language), Algorithms, Systems Design, Shell Scripting, Flask, Django REST Framework, Redis, PostgreSQL, Python (Programming Language), Django, Machine Learning, C++, MongoDB, SQL, Object-Oriented Programming (OOP), Data Structures, JavaScript, NoSQL, MySQL, English, Natural Language Processing (NLP), Neo4j",Bachelor of Engineering,Savitribai Phule Pune University (SPPU),Spark and Python for Big Data with PySpark,Bengaluru,Karnataka,India,backendFinal
SDE,Niyo Solutions Inc.,4.3,"Gin, Kafka, Sqs, Systems Design, Golang, Go (Programming Language), NestJS, MongoDB, React.js, JavaScript, Java, Node.js, MySQL, PHP, Python (Programming Language), Programming, Problem Solving, Object-Oriented Programming (OOP), Computer Science",Bachelor of Technology - BTech,"Ravindra College of Engineering for Women, kurnool","hacker rank certificate(problem solving(basic)), hackerrank certificate(problem solving (intermediate)), hackerrank certificate(python(basics)), Python 3 tutorial",Bengaluru,Karnataka,India,backendFinal
Software Engineer,Tech Mahindra,2.8,"Adobe Experience Manager (AEM), Javascript , Php , Laravel, React.js, Tailwind CSS, MERN Stack, Tkinter, springboot, Flask, Java, Spring Boot, Matplotlib, HTML, PHP, Cascading Style Sheets (CSS), java, JavaScript, MySQL, C++, C (Programming Language), Python (Programming Language)",Masters of Computer Applications,"Assam Engineering College, (A.E.C)","Cloud computing, Cryptography and network security ",Bengaluru,Karnataka,India,backendFinal
Senior Associate Consultant,Infosys,4.9,"Oracle Db, Web Development, MySQL, Perl, C++, SQL, API Development, Spring Security, Spring Boot, Spring MVC, Spring Framework, Core Java",Bachelor of Engineering - BE,KLE College of Engineering & Technology,,Bengaluru,Karnataka,India,backendFinal
Consultant,Deloitte,5.9,"Spring Framework, Go (Programming Language), J2EE Web Services, J2EE Application Development, Spring Security, SQLite, Skill Development, Technical Solution Design, Swagger API, RESTful architecture, API Development, Software Architecture, Model-View-Controller (MVC), Google Cloud Platform (GCP), Test-Driven Development, TestNG, Jakarta Persistence, Code Review, Problem Solving, Unit Testing, JUnit, Java Script, HTML5, Autosys, Pivotal Cloud Foundry (PCF), Apache Kafka, Design Patterns, Agile & Waterfall Methodologies, Java8, java11, REST APIs, Back-End Web Development, Jira, API Testing, Leadership, Team Management, Communication, Spring Boot, MySQL, Microservices, Java, Data Structures, C (Programming Language), Analytical Skills, C++, SQL, MongoDB, Microsoft Office, DBMS, JavaScript",Master of Business Administration - MBA,Rajiv Gandhi Prodyogiki Vishwavidyalaya,Industrian Training On Cloud Computing,Bengaluru,Karnataka,India,backendFinal
Technical leader,Trigent Software Inc,11.5,"Technical Leadership,  microservices, Amazon Web Services (AWS), API Development, Migration Projects, Microsoft SQL Server, ASP.NET MVC, SignalR, Bootstrap, jQuery, Microservices, .NET Core, AWS Lambda, Node.js, C#, JavaScript, .NET Framework, Amazon Simple Notification Service (SNS), Entity Framework, TFS, SQL Server Management Studio, Amazon Dynamodb, Agile Web Development",Bachelor's degree,Solapur University,,,,India,backendFinal
Senior Software Engineer,Google,9.0,"System Development, Analytical Skills, Technical Leadership, Algorithms, Python, Django, Bootstrap, Programming, Web Development, JavaScript, SQL, C, C++, Cascading Style Sheets (CSS), git, Python (Programming Language), redis, celery, RabbitMQ, Node.js, MongoDB, Amazon Web Services (AWS), docker, Microservices, Express.js, Object-Oriented Programming (OOP), Software Development Life Cycle (SDLC), Problem Solving, Data Structures, Coding Experience, Design Patterns, System Architecture, Scalability, Architectural Design, Software Development, RESTful WebServices, REST API, Databases, Back-End Web Development",Bachelor of Engineering (B.E.),"M.B.M. Engineering College, Jodhpur",,Bengaluru,Karnataka,India,backendFinal
Backend Engineer,BHIVE Workspace,5.6,"Engineering, FastAPI, Back-End Web Development, Cascading Style Sheets (CSS), Server Side, Product Requirements, Storyboarding, Containerization, Google Cloud Platform (GCP), Version Control, Code Review, Communication, ActiveRecord, Internet Software, Software Development, Bootstrap (Framework), Low-Level Design, High-Level Design, JSON, Git, Software Development Life Cycle (SDLC), Root Cause Analysis, User Requirements, Behavior-Driven Development (BDD), Test-Driven Development, Technical Documentation, Data Structures, Microservices, GraphQL, Computer Science, Business Requirements, RubyMine, Kotlin, Android Development, Programming, Java, Teaching, C#, Web Services, Debugging, Python (Programming Language), Selenium, Jmeter, C++, C (Programming Language), Ruby on Rails, Figma (Software), Rails, Django, Django REST Framework, Amazon Web Services (AWS), Amazon EC2, Amazon S3, Amazon Relational Database Service (RDS), Ruby",Master of Computer Applications - MCA,"Gogte Institute of Technology, Belgaum","Programming in C#: A comprehensive approach to C# Fundamentals, Advanced Global Project-Based Learning Program at Shibaura Institute of Technology, Japan, Japan-Asia Youth Exchange program in Science(SAKURA Exchange Program in Science), The Joy of Computing Using Python, Virtual Reality & Internet of Things (IoT), Android Certification",Bengaluru,Karnataka,India,backendFinal
IT Analyst,Tata Consultancy Services,4.3,"ServiceNow, Amazon Web Services (AWS), Angular, Express.js, JavaScript, Node.js, MongoDB, TypeScript, Java, Core Java, C (Programming Language), C++, Data Structures, Algorithms, Microsoft Azure, Azure Data Factory, Azure Functions, AutoCAD, AutoCAD 2D",Bachelor of Technology - BTech,KCC INSTITUTE OF TECHNOLOGY AND MANAGEMENT,"Microsoft Certified: Azure Developer Associate, Codechef CCDSAP Foundation, Microsoft Certified: Azure Fundamentals, Java Programming: Solving Problems with Software, NPTEL - Introduction to Programming in C, Autodesk Certified User: AutoCAD",Bengaluru,Karnataka,India,backendFinal
Senior backend developer,LSEG (London Stock Exchange Group),5.2,"Google Cloud Platform (GCP), Software Design, Next.js, Amazon Web Services (AWS), Firebase, HTML5, Full-Stack Development, Back-End Web Development, SQL, TypeScript, REST APIs, Amazon EC2, Cloud Firestore, Futures Trading, JavaScript, Cascading Style Sheets (CSS), Node.js, Mobile Applications, Front-End Development, Dart, Redux.js, Android Studio, Application Development, Flutter, React.js, Android Development, Photography, Object-Oriented Programming (OOP), Video Editing, Software Development, Programming, Software, Android, Python (Programming Language), React Native",Masters in Leadership Science,"Chanakya International Institute of Leadership Studies, University of Mumbai","Software Engineering virtual experience, IOT Bootcamp, Microsoft Technology Associate: Web Development Fundamentals (MTA)",Bengaluru,Karnataka,India,backendFinal
Member of Technical Staff,Tessell,5.9,"Scala, AWS Lambda, Elasticsearch, Apache Spark, Amazon Web Services (AWS), Amazon Dynamodb, Amazon Cognito, AWS Step Functions, Algorithms, Java, Microsoft Excel, Programming, React.js, AngularJS, HTML, C (Programming Language)",Bachelor of Technology - BTech,"Indian Institute of Technology, Guwahati",,Bengaluru,Karnataka,India,backendFinal
Software Engineer III,Walmart Global Tech India,4.2,"R2dbc, Reactive Programming, Parallel Computing, REST APIs, Server Side, Microservices, Airflow, Event horizon, Communication, Jira, Confluence, Spring Boot, Microsoft Azure, Azure SQL, Eventhub, Node.js, PostgreSQL, C (Programming Language), Python (Programming Language), Java, PHP, HTML, JavaScript, Bootstrap, Cascading Style Sheets (CSS), MySQL, Express.js, Cassandra, GraphQL, Apache Kafka, AWS Lambda",Bachelor of Technology - BTech,ABES Engineering College,"Problem Solving(basic), Python (Basic), Basics of Java, Data Science , Fundamentals of Python, Python for Data Science, Python for Data science, C++ For C Programmers, Part A, Problem solving through programming in C, Programming Essentials in Python, Programming, Data Structures and Algorithms in Python, Python Data Structures",Bengaluru,Karnataka,India,backendFinal
Associate Software Engineer,Mygate,3.0,"Amazon Web Services (AWS), Spring Boot, Java, Ray Cluster, Shell Scripting, Microservices, Vector Search, Milvus Vector database, Python (Programming Language), FastAPI, Apache Airflow, Apache Superset, Data Structures, MySQL, CI/CD, styled-components, User Interface Design, Red Hat Enterprise Linux (RHEL), Go (Programming Language), Docker , Kubernetes, HTML, REST APIs, SQL, Back-End Development, Redux Thunk, React.js, C++, JavaScript, Front-end Development, Node.js, MongoDB, Git, Cascading Style Sheets (CSS), HTML5, Bootstrap, GitHub, Express.js",Bachelor of Technology - BTech,Cochin University of Science and Technology,,Bengaluru,Karnataka,India,backendFinal
Software Development Team Lead,Accenture in India,7.3,"Machine Learning, Azure Data Factory, FastAPI, Natural Language Processing (NLP), Pandas, Docker, Docker compose, Code Review, Software Development, Jira, Debugging, Optimization, Perl, Perl Automation, Python, Django, Flask, MongoDB, PostgreSQL, Django REST Framework, Pandas (Software), Web Scraping, Face Recognition, Object Detection, NumPy, GitHub, DigitalOcean, Amazon Web Services (AWS), Python (Programming Language), Linux, C (Programming Language)",Bachelor of Technology - BTech,Climate AI,"Learn Python - Python Programming For Beginners From Scratch, Docker for the Absolute Beginner - Hands On - DevOps",Bengaluru,Karnataka,India,backendFinal
Associate Software Engineer,Twinleaves,3.0,"PostgreSQL, Gradle, Google Cloud Platform (GCP), HTML5, ASP.NET MVC, .NET Framework, ASP.NET Razor, Nuget, Entity Framework (EF) Core, Microsoft SQL Server, AngularJS, Python (Programming Language), C, Entity Framework, Dot net mvc, .NET Core, C#, Algorithms, Jakarta Persistence, Full-Stack Development, Tomcat, Microservices, Swagger API, Postman API, GitHub, Java Database Connectivity (JDBC), Spring Data, Spring MVC, Core Java, SQL, J2EE Web Services, JavaSE, Project Management, Presentations, Communication, Object-Relational Mapping (ORM), Hibernate, Spring Framework, Data Structures , Spring Boot, Java, JavaScript, HTML, DATA Structres and ALgorithm, Cascading Style Sheets (CSS), MySQL, Back-End Web Development, Problem Solving, Programming, Object-Oriented Programming (OOP), Teamwork, Engineering, Mechanical Engineering",,Masai,"Communication skills , WEB Development , Microsoft Certified Technology Associate, English Typing",Bengaluru,Karnataka,India,backendFinal
Associate Technology L2,Publicis Sapient,5.1,"Apache Kafka, Object Oriented Design, REST APIs, SQL, Kibana, Spring Framework, Spring Security, Hibernate, Amazon Web Services (AWS), Java Microservice, Spring Boot, Core Java, HTML5, Cascading Style Sheets (CSS), JavaScript, PhpMyAdmin",Bachelor of Technology - BTech,C.V.Raman College of Engineering,,Bengaluru,Karnataka,India,backendFinal
Lead Engineer,HCLTech,4.0,"Mockito, Jira, Agile Methodologies, Redis, REST APIs, RESTful WebServices, JavaServer Pages (JSP), Java Database Connectivity (JDBC), NoSQL, PostgreSQL, Oracle Database, MySQL, MongoDB, GraphQL, gRPC, Microsoft Azure, RabbitMQ, Maven, Apache Kafka, Java Application Development, Java Development, Java Software Development, Maven , Elasticsearch, API Gateways, Liquibase, JSON Web Token (JWT), Okta authentication , Spring boot kafka, Twillo, HQL, jpa, hibernate , Git, GitHub, cqrs, saga, JUnit, twillio , elastic seach, Amazon S3, Microservice, Core Java, Data Structures, SQL, Hibernate, Spring Boot, java8, Spring Security, OWASP, Web Application Security",Bachelor of Technology - BTech,"Bengal College of Engineering and Technology (BCET), Durgapur",Learning the OWASP Top 10,Bengaluru,Karnataka,India,backendFinal
Backend Developer,IBM,5.0,"IBM Cloud, Kubernetes, Unit Testing, JSON Web Token (JWT), Digital Signatures, Object-Oriented Programming (OOP), Linux, Design Patterns, DevOps, API Development, Redis, Data Structures, gRPC, Apache Kafka, SQLite, SQL, Python, Docker, Microservices, MariaDB, Git, REST APIs, Go (Programming Language)",Bachelor's degree,Visvesvaraya Technological University,,Bengaluru,Karnataka,India,backendFinal
Backend Developer,IBM,5.9,"Interpersonal Skills, User Requirements, Application Programming Interfaces (API), Version Control, Agile Methodologies, English, Software Development, Communication, Code Review, Programming, REST APIs, Microservices, Go, Go (Programming Language), Apache Kafka, PostgreSQL, Java, Core Java, SQL, HTML, Spring Boot, Representational State Transfer (REST), MySQL, Git, Agile Application Development, Scrum",Bachelor of Technology,Techno India Institute of Technology,Python(Basic),Bengaluru,Karnataka,India,backendFinal
Software Engineer,Woiswp technologies pvt ltd,1.9,"Python, MySQLi, C#, MySQL, Back-End Web Development, Computer Science, Programming, PHP, Application Programming Interfaces (API), Ui/ux, XML, Retrofit, Git, GitHub, Core Java, Data Science, JavaScript, Artificial Intelligence (AI), Cascading Style Sheets (CSS), HTML5, Visual Studio, React.js, Node.js, Anaconda, Jupyter, Machine Learning, Full-Stack Development, Machine Learning Algorithms, Natural Language Processing (NLP), Front-End Development, Team Problem Solving, Test Planning, Software Testing, SQL, C (Programming Language), Software Development, Android Development, Design Analysis, Data Structures, Mobile Application Development, Django, Python (Programming Language), C++, HTML, Database Management System (DBMS), Java, Web Development, Object-Oriented Programming (OOP), Problem Solving",Bachelor of Engineering - BE,Visvesvaraya Technological University,"SQL Advanced, Software Engineer, CSS(Basic), Introduction to Programming Using JavaScript, Problem Solving(Intermediate), Introduction to Programming Using Python, java, problem solving, Software Engineer Intern, Certificate of Appreciation, Full Stack Web Development, Machine Learning with python, Microsoft Professional Program in Artificial Intelligence, SQL(basic), sql",Bengaluru,Karnataka,India,backendFinal
,,,"Java, Back-End Web Development, Spring Boot, Programming Concepts, Programming Languages, SQL, Programming, C#, Core Java, Communication, Problem Solving",Bachelor of Technology - BTech,JNTU Anantapur,Getting Started with AI and Machine Learning,Bengaluru,Karnataka,India,backendFinal
Software Engineer,Manhattan Associates,4.8,"Microservices, Tomcat, REST APIs, postman, Oracle Database, mysql, Agile Methodologies, Scrum, Visual Studio, Data Structures, Computer-Aided Design (CAD), AutoCAD, Web Application Development, Back-end Operations, Amazon Web Services (AWS), Jenkins, Spring Framework, MySQL, Spring Boot, React.js, JavaScript, Java, Solid Edge, SOLIDWORKS, CATIA, HTML5, Cascading Style Sheets (CSS), Node.js, HTML, Programming, Bootstrap, GitHub",Bachelor of Engineering - BE,"The National Institute Of Engineering, Mysore",,Bengaluru,Karnataka,India,backendFinal
Consultant,Deloitte,6.2,"Amazon Web Services (AWS), FastAPI, Flask, Product Design, Database Design, Linux, SQL, Bash, Software Development, Database Management System (DBMS), Data Analysis, Product Management, Analytical Skills, Python (Programming Language), PostgreSQL, React.js, JavaScript, REST APIs, NumPy, pandas, data structures and algorithms",B.Tech ,Mody University ,"GIT, Linux administrator , Algorithms, React js bootcamp, 2020 Complete Python bootcamp, Python and Django bootcamp",Bengaluru,Karnataka,India,backendFinal
Senior Software Engineer,"Love, Bonito",8.5,"Web Development, Java, Amazon Web Services (AWS), Object-Oriented Programming (OOP), Node.js, JavaScript, npm",M.Tech,Amity University Lucknow Campus,"Advanced Node.js: Scaling Applications, Advanced npm, Node.js Essential Training, Oracle Certified Associate, Java SE 8 Programmer, AWS Certified Solutions Architect – Associate, Fundamentals of Virology, Javascript",Bengaluru,Karnataka,India,backendFinal
Computer Aided Design Engineer,Spixer AI,1.2,"C#, Wpf, Backend , Pandas, Jupyter, Pandas (Software), Seaborn, Jyupter, Pivot Tables, Excel Dashboards, Power BI, DAX, Kaggle, SQL, Microsoft Excel, Microsoft Power BI, Python (Programming Language), Data Analysis, Engineering Design, Mechanical Engineering, Computer-Aided Design (CAD), React.js, JavaScript, HTML5 , Engineering, Front-End Development, English, Design, Communication",Bachelor of Engineering - BE,Visvesvaraya Technological University,"DAX formulas for Power, Describe Power BI Desktop models, The Web Developer Bootcamp 2024",Bengaluru,Karnataka,India,backendFinal
Software Engineer,Eurofins,1.8,"Redis, Docker, React context API, Express js, Node js, Node.js, Express.js, MongoDB, bcrypt, JSON Web Token (JWT), Competitive Programming, Data Structures, Front-end Development, Object-Oriented Programming (OOP), C++, HTML5, Cascading Style Sheets (CSS), JavaScript, React.js, C (Programming Language), Problem Solving, English, Hindi",Bachelor of Technology - BTech,National Institute of Technology Agartala,,Bengaluru,Karnataka,India,backendFinal
Packaged App Development Senior Analyst ,Accenture,4.8,"error handling, Swagger API, REST APIs, JSON Web Token (JWT), Mongoose ODM, Model-View-Controller (MVC), Embedded JavaScript (EJS), npm, Git, HTML, Cascading Style Sheets (CSS), JavaScript, Bootstrap (Framework), Node.js, Express.js, MongoDB, React.js, Firebase, Amazon Web Services (AWS), SQL, postman, Art Technology Group (ATG), Oracle SQL Developer, Core Java, Java, C (Programming Language)",Bachelor of Engineering - BE,Sona College of Technology,,Bengaluru,Karnataka,India,backendFinal
Backend developer ,IBM,8.2,"Go (Programming Language), Microservices, Kibana, Redis, Apache Kafka, Kubernetes, Docker Products, API Development, Ansible, Microsoft Office, C, Microsoft Excel, Windows, HTML, JavaScript, Management, HTML5, CSS, Cascading Style Sheets (CSS), Microsoft PowerPoint, VHDL, jQuery, MySQL, Node.js, Python, Mentor Graphics, Linux, Team Management, Leadership, Matlab, PHP, Elasticsearch, Integration, Continuous Integration and Continuous Delivery (CI/CD), OAuth, DevOps, Software, Programming",Bachelor of Technology (B.Tech.),The LNM Institute of Information Technology,"Front-End JavaScript Frameworks: AngularJS, Front-End Web UI Frameworks and Tools, HTML, CSS and JavaScript, Mastering Data Analysis in Excel, Responsive Website Basics: Code with HTML, CSS, and JavaScript , Managing Big Data with MySQL, Programming Foundations with JavaScript, HTML and CSS",Bengaluru,Karnataka,India,backendFinal
Python/Django Course,Besant Technologies Bengaluru (BTM Layout),3.2,"Databases, REST APIs, Postman API, Amazon Web Services (AWS), Docker , SQL, JavaScript, Cascading Style Sheets (CSS), HTML5, Python (Programming Language), Django",Bachelor of Computer Applications,"SESHADRIPURAM COLLEGE, Nagappa St, 4th Block, VV Giri Colony, Seshadripuram, Bengaluru, Karnataka 560020",,Bengaluru,Karnataka,India,backendFinal
Senior Software Engineer,Intuit,10.2,"NoSQL, Java Development, Apache Kafka, PostgreSQL, Jenkins, Vector Databases, Open API, AI Agents, Artificial Intelligence (AI), Microservices, Distributed Systems, Angular, Elasticsearch, Amazon Web Services (AWS), Java, Object-Oriented Programming (OOP), Core Java, Spring Boot, J2EE Web Services, SQL, DBMS, Web Design, Software Development, Big Data, Programming, MapReduce, Hadoop, c#, HBase, MySQL, php, HTML, JavaScript, CSS, ASP.NET, C++, C, Microsoft Office, Microsoft Excel, Linux, Leadership, Apache Pig, Hive, Sqoop, TIBCO iProcess, TIBCO EMS, TIBCO BusinessWorks, Communication, IT Management",Bachelor of Technology (B.Tech.),Techno India College Of Technology,"Improve Your Technical Communication Skills, Mastering Communications as a Leader, Java SE 8 Programmer , Problem Solving, Big Data and Hadoop Developer, Big Data and Hadoop Developer with 3 months real time hands on exprience, Java Essentials for Hadoop, AMCAT Certified Channel Sales Professional, AMCAT Certified Collections Specialist, AMCAT Certified Customer Service Specialist, AMCAT Certified Data Processing Specialist, AMCAT Certified Telesales Professional",Bengaluru,Karnataka,India,backendFinal
Consultant b2,Capgemini,3.9,"Sonarqube, Agile Methodologies, Rally, Keycloak, Microservices, Hibernate, MySQL, Spring Boot, Core Java",Master of Computer Applications - MCA,Visvesvaraya Technological University,,Bengaluru,Karnataka,India,backendFinal
Software Engineer,Corestrat,6.4,"Flask, Inno Setup, React.js, VBScript, Interdisciplinary Collaboration, Article Writing, Search Engine Optimization (SEO), SYCL, Python (Programming Language), Content Development, 5G, Full-Stack Development, Technical Marketing, Technical Writing, SQL, HIL, English, Communication, Presentations, Problem Solving, Leadership, Research, Analytical Skills, Multilingual, Programming",Master of Computer Applications - MCA,"Christ University, Bangalore","Introduction to Natural Language Processing, CompTIA A+ Core 1: Networking Fundamentals, Networking Standards and Connections, Cloud Blockchains: An Introduction to Blockchain on the Cloud, Introduction to Artificial Intelligence, Programming Fundamentals: Introduction to Programming, PCAP: Programming Essentials in Python, oneAPI Ambassador Level 1, Cybersecurity Fundamentals, Problem Solving Using Computational Thinking",Bengaluru,Karnataka,India,backendFinal
Technology Analyst,Infosys,4.3,"Java , Plsql, Kakfa, Spring Boot, Hibernate, Core Java, PL/SQL, kafka-tools, Microservices, Oracle Database, Integrated Systems, Systems Management, Data Analysis, Analytical Skills, Java, Oracle SQL Developer, PostgreSQL, Kafka Streams, Apache Kafka",Bachelor of Technology - BTech,Pace Institute of Technology & Sciences,,Bengaluru,Karnataka,India,backendFinal
Backend Developer,Marmeto,2.8,"GraphQL, E-Commerce, Nginx, JSON Web Token (JWT), Shopify, Spring Boot, Confluence, Jira, Git, Citrix Workspace, MongoDB, Redis, Amazon EC2, Bitbucket, React.js, Express.js, Node.js, Core Java, PostgreSQL, MySQL, Databases, JavaScript, Cascading Style Sheets (CSS), HTML, Data Structures, Java, Engineering",Bachelor of Technology - BTech,Bharati Vidyapeeth's College of Engineering,,Bengaluru,Karnataka,India,backendFinal
