current_position,current_company,years_of_experience,total_skills,education_degree,education_institution,certifications,city,state,country,profile_type
Contingent Worker 1,ING Belgium,10.1,"Docker, Microservices, JUnit, Microsoft Azure, Electronics and Communication Engineering, Core Java, SQL, Web Technologies, REST APIs, Decision-Making, Problem Solving, Spring Framework, Ms excel, HTML, Cascading Style Sheets (CSS), Spring Boot, Maven, Git, IntelliJ IDEA, Microsoft Office, Java, Public Speaking, Social Media, Microsoft Excel, Microsoft Word, Microsoft PowerPoint",Bachelor of Technology,Budge Budge Institute of Technology 276,"Data Structures, Microsoft Certified: Azure Administrator Associate",Bengaluru,Karnataka,India,backendFinal
Software Engineer,Wissen Technology,4.3,"Spring boot , Hibernate , Jakarta Persistence, Jenkins, Multithreading, Design Patterns, Oops, Core Java, Critical Thinking, Algorithms, Systems Design, Swagger, Business Requirements, Database Management System (DBMS), Spring MVC, Model-View-Controller (MVC), Spring Security, Version Control, REST APIs, Communication, Application Programming Interfaces (API), API Documentation, Backend, Angular, Apache Kafka, Redis, Microsoft Azure, Data Structures, Software Development, Maven, C (Programming Language), Full-Stack Development, Java, Java Developer, Spring Framework, Spring Boot, Object-Oriented Programming (OOP), Back-End Web Development, HTML, Cascading Style Sheets (CSS), JavaScript, Front-End Development, MySQL, Problem Solving, Hibernate, Microservices, HTML5, Toad, AngularJS, Bootstrap",Bachelor's degree,Government Engineering College Azamgarh,"AWS Certified Cloud Practitioner, Competitive Programming, GATE Qualified",Bengaluru,Karnataka,India,backendFinal
Senior Software Engineer,Xylem,4.2,"Apache NiFi, ETL Development, PostgreSQL, Kibana, Scalable Web Applications, Computer Science, JSON, Problem Solving, Software Development Life Cycle (SDLC), Agile Methodologies, Spring Boot, Object-Oriented Programming (OOP), Jira, Docker, Kubernetes, Jenkins, Git, Maven, Apache Kafka, Java, Spring MVC, MongoDB, Multithreading, Digital Media, Marketing, Marketing Strategy, Sales Management, Account Management, C (Programming Language), C++, Core Java, Spring Framework, Hibernate, Java Database Connectivity (JDBC), Servlets, Tomcat, MySQL, oracle sql, SQL, JavaScript, HTML5, Cascading Style Sheets (CSS), Tally ERP, Management, Microservices, J2EE Web Services, J2EE Application Development, Talend, Talend Open Studio, SQL*Plus, NoSQL, Web Services, Model-View-Controller (MVC), Vert.x, ETL, Data Integration",Bachelor of Engineering (B.tech),Siksha 'O'​ Anusandhan University,Google Digital Garage - The Fundamentals of Digital Marketing,Bengaluru,Karnataka,India,backendFinal
Back End Developer,Techjet,5.2,,Bachelor of Technology - BTech,MDIT ULLIYERI,,,Kerala,India,backendFinal
Back End Developer,DREX,0.9,"CSS, Amazon EC2, xTerm, MySQL, Sequelize, RabbitMQ, FCM, Nginx, Software Design, React MobX, Amazon Web Services (AWS), Docker, Docker , JSX, CPU , CPU Scheduling, OOPs, SOLID Design Principles, API Integration , Geolocation API, Weather API, Leaflet, Full-Stack Development, Front-End Development, REST APIs, Version Control, Ubuntu, Linux, PostgreSQL, JSON, Redis, Robot Operating System (ROS), DevOps, Django REST Framework, Django, Problem Solving, Analytical Skills, Stripe API, Multithreading, nodejs, Application Programming Interfaces (API), Embedded JavaScript (EJS), Operating Systems, SQL, Databases, Socket.io, bcrypt, JSON Web Token (JWT), Algorithms, Python (Programming Language), Git, React.js, MERN Stack, Object-Oriented Programming (OOP), Programming Languages ,  Relational Databases , Data Structures, Node.js, MongoDB, HTML, Cascading Style Sheets (CSS), Bootstrap (Framework), JavaScript, Express.js, Mongoose, C++",Bachelor of Technology - BTech,National Institute of Technology Hamirpur-Alumni,"SQL (Advanced) Certificate, Mern Stack Development",Bengaluru,Karnataka,India,backendFinal
Software Engineer,Pincode,6.1,"Kubernetes, microservices, Docker Products, GitHub, Data Structures, Algorithms, Computer Networking, Dropwizard, Microservices, Google Cloud Platform (GCP), PostgreSQL, B2C e-commerce, Go (Programming Language), Machine Learning, Python (Programming Language), Database Management System (DBMS), Data Science, Java, JavaScript, React.js, MongoDB, Flask, Django, Blockchain, Scikit-Learn, Node.js, TypeScript",Bachelor of Technology,KALYANI GOVERNMENT ENGINEERING COLLEGE 102,,Bengaluru,Karnataka,India,backendFinal
Software Engineer II,Blue Yonder,4.9,"Technical Documentation, Java Application Development, User Datagram Protocol (UDP), Transmission Control Protocol (TCP), Apache, Scrum, Telecommunications, Multithreading, JSON, Docker Products, Passionate about Work, Technical Requirements, Product Development, Maintainability, Skill Development, Cloud Computing, Migration Projects, API Development, Software Deployment, Application Programming Interfaces (API), Low-Level Design, Algorithms, Agile Environment, Database Management System (DBMS), Technical Design, Software Development Life Cycle (SDLC), Design, Programming Languages, System Requirements, Performance Metrics, Software Development, Computer Science, Back-End Web Development, kafka-tools, J2EE Web Services, Amazon Relational Database Service (RDS), Spring Data, Amazon Web Services (AWS), Spring Security, Performance Tuning, Data Structures, Databases, Core Java, Java Development, GraphQL, Microservices, Representational State Transfer (REST), Hibernate, Object-Oriented Programming (OOP), Continuous Integration and Continuous Delivery (CI/CD), SQL, Web Applications, Spring Framework, GitHub, Reliability, Server Side, Architecture, Analytics, Troubleshooting, Optimization, Attention to Detail, Performance Engineering, Peer Reviews, Data Integrity, Design Review, Analytical Skills, Coding Standards, Technical Architecture, Web Technologies, Code Review, Optimizing Performance, High Energy Level, Software Implementation, Product Requirements, Database Queries, Software Lifecycle, Debugging, Integration Testing, Java Database Connectivity (JDBC), Coding Experience, OAuth, Design Patterns, Communication, Interpersonal Skills, Technical Proficiency, Problem Solving, Grafana, InfluxDB, Next Generation Hotspot Solution, Apache Kafka, RESTful WebServices, REST APIs, Java, Spring Boot, REST API, MySQL, Spring MVC, Firebase, NoSQL, Git",Bachelor of Technology - BTech,Manipal University Jaipur,AZ-900 : Microsoft Certified Azure Fundamentals,Bengaluru,Karnataka,India,backendFinal
Software Engineer,Virtusa,3.8,"ASP.NET, Systems Design, Microservices, Low-Level Design, Cyber, Spring Boot, React.js, Computer Science, Spring Framework, Passionate about Work, Microsoft Azure, English, Azure Functions, Programming Languages, Entity Framework, JScript, HTML5, Bootstrap, Analytical Skills, Model-View-Controller (MVC), Databases, Cascading Style Sheets (CSS), Language Integrated Query (LINQ), MySQL, Microsoft SQL Server, JavaScript, Software Development, DSA, Object-Oriented Programming (OOP), Python (Programming Language), C (Programming Language), Java, Data Analysis, Programming, Data Structures, C++, HTML, SQL, Linux, Machine Learning Algorithms, Core Java, Data Analytics, .NET Framework",Bachelor of Technology,Technocrats Institute of Technology. ,"Introduction to CyberOps, ASP.NET, .Net Framework, Data Analysis Using Python, Data Visualization Using Python, Python for Data Science, Programming for Everybody (Getting Started with Python)",Bengaluru,Karnataka,India,backendFinal
Software Engineer III,JPMorgan Chase & Co.,6.5,"Multithreaded Development, Splunk, GAP, Spring Security, Amazon Web Services (AWS), Docker, Kubernetes, Thanos, Prometheus, Apache Kafka, Spring Framework, Multithreading, Redis, Vault, REST APIs, Java, MySQL, Hibernate, Kibana, Grafana, Jenkins, React.js, Spring Boot, Object-Oriented Programming (OOP), Oracle Database, JUnit, Selenium Testing, Angular7, JavaScript, HTML5, Cascading Style Sheets (CSS), Bootstrap, Jest, GitHub, Linux, IntelliJ IDEA, Postman API, Microsoft Visual Studio Code, Microsoft Office, Team Management, Public Speaking, Leadership, English, Hindi",Bachelor of Technology,Jamia Millia Islamia,Certificate of Excellence,Bengaluru,Karnataka,India,backendFinal
Member of Technical Staff,Oracle,3.9,"React.js, TypeScript, Problem Solving, C++, Python (Programming Language), Art, Object-Oriented Programming (OOP), Data structures and algorithms , Team Building, Database Management System (DBMS), Express.js, Node.js, Flask, Git, REST APIs, Operating Systems, Spring Boot, Core Java",Bachelor of Technology - BTech,Thapar Institute of Engineering & Technology,"Industry Development Education  Technical Training Course, Python Classes and Inheritance, C++ (Basic) Certificate, Problem Solving (Basic) Certificate, Python Basics, Python Functions, Files, and Dictionaries, Python Project: pillow, tesseract, and opencv, Front-End Web UI Frameworks and Tools: Bootstrap 4, Introduction to Docker: Build Your Own Portfolio Site, Programming for Everybody (Getting Started with Python), Python Data Structures, Server-side Development with NodeJS, Express and MongoDB",Bengaluru,Karnataka,India,backendFinal
Software Engineer,Microsoft,1.3,"C, Algorithm, Data Structures, Android Development, Big Data, Machine Learning, Image Processing, Data Mining, Java, JavaScript, Core Java, Java Database Connectivity (JDBC), Cascading Style Sheets (CSS), HTML, HTML5, Adobe Illustrator, C (Programming Language), SQL, Operating Systems, Android, Python (Programming Language), Pandas (Software), Seaborn, Anaconda, Android Studio, CSS Sprites, Database Management System (DBMS), NumPy, Logistic Regression, Linear Regression, tweepy",,,"Deep learning by Andrew NG, Machine learning ",Bengaluru,Karnataka,India,backendFinal
Software Engineer II,Microsoft,14.2,"Object-Oriented Programming (OOP), Pattern Development, Coaching & Mentoring, Realistic Animation, Error Correction, Accessibility Testing, Desktop Application Development, Software Testing, Operational Efficiency, Database Optimization, Data Structures, Azure DevOps Server, Release Engineering, Post-tensioning, Usability, Adaptive Design, Application Development, WinForms, .NET in Azure, Scenario Testing, Responsive Web Design, Microsoft Development, Versioning, Railway Systems, Coordinating Programs, Recommender Systems, Front-End Development, Azure DevOps Services, Mobile Device Components, Release Management, Career Counseling, Java Native Interface (JNI), JavaServer Pages (JSP), Global Deployment, Healthcare Improvement, Camera Calibration, Customer Service, Test Designing, Software Design Patterns, JSP, AJAX, Singleton Pattern, XAML, Java Code Coverage, SQLite, JUnit, Mockito, JavaFX, REST APIs, JNA, Sonarqube, System design, Spring Boot, Azure DevOps, xUnit, Moq, Nuget, Accessibility, Open Source, SOLID Design Principles, Distributed Systems, Microservices, Team Leadership, Cross-functional Team Leadership, Windows Communication Foundation (WCF), Core Java, Software Design, Low Level Design, High Level Design, Continuous Integration and Continuous Delivery (CI/CD), Systems Design, Java, High-Level Design, Low-Level Design, C#, Windows Presentation Foundation (WPF), ASP.NET, Agile Methodologies, kanban, Requirements Analysis, Software Development, Software Development Life Cycle (SDLC), SQL, JavaScript, .NET, Microsoft SQL Server, Team Management, Team Building, Telerik, XML Schema Definition (XSD)",Master of Technology,Delhi Technological University (Formerly DCE),Microsoft Global Hackathon 2021,New Delhi,Delhi,India,backendFinal
Associate Consultant,Oracle in Financial Services,11.3,"JavaScript, MySQL, Linux, Programming, Database Administration, C++, HTML scripting, CSS, Oracle, C++ Language, core java, Spring MVC, Hibernate, Unix, Shell Scripting, Servlets, JSP, JSTL, Selenium, Multithreading, HSQLDB, Java, HTML, JavaServer Pages (JSP), Core Java, NoSQL, MongoDB, Agile Methodologies, Computer Science, Problem Solving, Distributed Systems, RabbitMQ, Microservices, Messaging",Bachelor of Engineering (B.E.),sri sairam institute of technology,"Financial Markets- A beginer Module (NCFM), Oracle Certified Java Programmer",Bengaluru,Karnataka,India,backendFinal
Project Engineer,Wipro,3.6,"JavaScript, Bootstrap (Framework), Microservices, Databases, REST APIs, Linux, Eclipse, Java full stack , Oracle Applications, Groovy script , Angular, AngularJS, Representational State Transfer (REST), Hibernate, HTML, Web Services, Spring MVC, Spring Boot, Spring Data, RESTful WebServices, HTML5, Cascading Style Sheets (CSS), Core Java, Java, Web Development",Bachelor of Engineering - BE,"Gogte Institute of Technology, Belgaum",Java Full Stack,,Karnataka,India,backendFinal
Associate System Engineer,IBM,3.3,"RESTful WebServices, Shell Scripting, GitHub, JavaScript, Node.js, Microservices, Spring Boot, Java, Data Structures, MySQL, HTML, Cascading Style Sheets (CSS), Microsoft Office, IBM Websphere Commerce",MCA - Master of Computer Applications,International Institute of Professional Studies DAVV,"IBM Delivery Central Platform Foundations, IBM watsonx Essentials, watsonx.ai Sales Foundation, watsonx.ai Technical Sales Intermediate, Telecommunications Industry Jumpstart, Enterprise Design Thinking Practitioner, IBM Agile Explorer, IBM Consulting Way Habits - Foundational, IBM Consulting – Delivering Business Value, Microsoft Certified: Azure Fundamentals, IBM Certified Advocate - Cloud v2, Java, SQL",Bengaluru,Karnataka,India,backendFinal
Software Engineer,InspironLabs Software Systems Pvt Ltd,2.2,"MERN Stack, DSA, Organization Skills, MongoDB, Express.js, Redux.js, HTML, Front-End Development, React.js, Amazon Web Services (AWS), Node.js, OOPS, C++, Visual Basic .NET (VB.NET), Computer Networking, CSS, Communication, Computer Science, Code Review, Analytical Skills, Software, HTML5, Java Development, Cascading Style Sheets (CSS), JavaScript, Programming Languages, Microservices, Java Frameworks, Development Tools, Software Development, Multithreading, Object-Oriented Programming (OOP), Problem Solving, REST APIs, API Development, Spring Framework, Spring MVC, Maven, hibernet, JPA, MySQL, Git, GitHub, Postman API, Swagger API, Core Java, Hibernate, RDBMS, Spring Boot, Operating Systems, Programming, SQL, Algorithms, Data Structures, Java, English, Engineering, Leadership",Bachelor of Technology - BTech,Jaipur Engineering College and Research Centre (JECRC),"Full stack development, MySQL 5.6 Developer",Kota,Rajasthan,India,backendFinal
Software Development Engineer 2,Fox Corporation,6.2,"System design, Go (Programming Language), Microservices, Python (Programming Language), Python, SQL, Amazon Web Services (AWS), Flask, Apache Kafka, C#, Java, Django REST Framework, Node.js, JavaScript, Rust, Back-End Web Development, Machine Learning, Artificial Intelligence (AI), Web Development, Data Structures, Object-Oriented Programming (OOP), Software Development, Engineering, Computer Science, Deep Learning, TensorFlow, Keras, MySQL, C, Rust (Programming Language), Full-Stack Development, Keycloak, OAuth, OpenID Connect (OIDC), UMA",Bachelor of Technology,Manipal University Jaipur,,Bengaluru,Karnataka,India,backendFinal
Intern,Trinity Mobility,0.8,"Flask, MongoDB, Python (Programming Language), Git, HTML5, Maven, Relational Databases, Query Languages, RDBMS, REST APIs, Multithreading, Continuous Integration and Continuous Delivery (CI/CD), Web Applications, Programming Languages, C++, Agile Environment, Java Development, Web Development, Java Frameworks, Java API, Apache Kafka, Application Development, Databases, Oracle SQL Developer, Software Development, Programming, Oracle Database, MySQL, Spring Boot, Spring Framework, Microservices, Full-Stack Development, Front-End Development, Back-End Web Development, Jira, Amazon Web Services (AWS), Jenkins, Open API, Jdbc, Teamwork, Good communication , Team Leadership, Hibernate, Java Database Connectivity (JDBC), Problem Solving, PL SQL, HTML, Cascading Style Sheets (CSS), Software Development Life Cycle (SDLC), Agile Methodologies, JavaScript, Technical Presentations, Object-Oriented Programming (OOP), Core Java, Markup Languages, SQL, Presentations, Communication, C (Programming Language), Java",Bachelor of Engineering - BE,"Jain College of Engineering, BELGAUM",,Bengaluru,Karnataka,India,backendFinal
Lead Software Development Engineer,Razorpay,9.3,"Java, C++, C, HTML, SQL, Microsoft Excel, Spring MVC, Apache Kafka, Solr, PostgreSQL, Design Patterns",Bachelor’s Degree,"Shri Ramdeobaba Kamla Nehru Engineering College, Katol Road",,Bengaluru,Karnataka,India,backendFinal
Software engineer,Aziro (formerly MSys Technologies),4.8,"GitHub, Postman, SQL, MongoDB, Microservices, Go (Programming Language)",,,,Bengaluru,Karnataka,India,backendFinal
Software Engineer,GAMMASTACK,2.8,"Redis, Docker Swarm, PostgreSQL, Koa.js, SQL, Amazon Web Services (AWS), Databases javascript typescript sql psql mongodb, Git, GitHub, Nodejs, Mongoose ODM, JavaScript, Node.js, HTML, HTML5, React.js, Express.js, MongoDB, Cascading Style Sheets (CSS)",Bachelor of Arts - BA,Munger University,,Bengaluru,Karnataka,India,backendFinal
Backend Developer,Groww,7.9,"Cloudflare Workers, GraphQL, Apollo GraphQL, Scalability, Distributed Systems, Customer Experience, Go-to-Market Strategy, Offers, Gift Cards, Payments, Scala, Representational State Transfer (REST), Java, Core Java, Git, JSON, REST APIs, SQL, GitHub, Docker Products, API Development, Go (Programming Language), Play Framework, Akka, Application Programming Interfaces, Back-End Web Development",Bachelor of Technology (B.Tech.),"B K Birla Institute of Engineering & Technology, Pilani","Learning Docker, Learning GraphQL, Functional Programming in Scala, Core Java, Programming in Java",Bengaluru,Karnataka,India,backendFinal
Software Engineer 1,Tekion Corp,4.2,"MongoDB, Spring Boot, Java, Back-End Web Development, Django, HTML, Cascading Style Sheets (CSS), Bootstrap, JavaScript, C++, C (Programming Language), Python (Programming Language)",BTech - Bachelor of Technology,Indian Institute of Information Technology Guwahati,"Google Cloud, Hash Code 2020",Bengaluru,Karnataka,India,backendFinal
SDE 2,Twilio,3.9,"Competitive Programming, Data Structures, Algorithms, Java, Python (Programming Language), SQL, NoSQL, Apache Kafka, Amazon Web Services (AWS), Distributed Systems, Software as a Service (SaaS), REST APIs, Git, Distributed Applications, Dropwizard, Microservices, MySQL, Serverless Framework, Amazon Dynamodb, Elasticsearch, AWS Lambda, Software Development, Programming, Object-Oriented Programming (OOP), C++, C (Programming Language), Oracle Database, Problem Solving, Technical Design, Computer Science, Database Management System (DBMS), Version Control, Back-End Web Development",Bachelor of Engineering - BE,KLE Technological University - Hubballi (India),"AWS Academy Graduate - AWS Academy Cloud Foundations, Introduction to Software Testing, NoSQL systems",,Karnataka,India,backendFinal
Senior Software Engineer,Accolite,6.3,"Kafka Streams, Java, JUnit, Hibernate, MySQL, Microservices, Spring Boot, Core Java",Bachelor of Technology - BTech,Nitte Meenakshi Institute of Technology,,Bengaluru,Karnataka,India,backendFinal
AI Engineer 2,IQVIA,7.2,"Databricks Products, Large Language Models (LLM), Gitlab, RAG, Google Cloud Platform (GCP), Machine Learning, Azure DevOps Server, Streamlit, Forecasting, Natural Language Processing (NLP), MLflow, Unity Catalog, Continuous Integration and Continuous Delivery (CI/CD), Jupyter, AWS SageMaker, MLOps, Python, Azure Automation, Azure monitor, Microsoft Power Bi, SQL Server Management Studio, SQL Server Integration Services (SSIS), Microsoft Excel, Azure Data Factory, Azure Virtual Machines, MLOps Blog, Azure Blob, Role-Based Access Control (RBAC), JSON Web Token (JWT), Pandas, Postman API, Back-End Web Development, GitHub, Auzre Delta lake, Azure Databricks, Azure Telemetry, Django, Azure redis, PySpark, Django REST Framework, Python (Programming Language), Microsoft Azure, Power Bi , Azure Kusto, Cloud Computing, Microsoft SQL Server, Artificial Intelligence (AI), Computer Ethics, Generative AI, Docker Products, Generative AI Tools, Artificial Intelligence for Business, Search Engine Technology, Responsible AI",Bachelor of Technology,Visvesvaraya Technological University,"Databricks AI Fundamentals, Learning Docker, Career Essentials in Generative AI by Microsoft and LinkedIn, Introduction to Artificial Intelligence, Ethics in the Age of Generative AI, Generative AI: The Evolution of Thoughtful Online Search, What Is Generative AI?, IBM Certified Python for Data Science, Analyzing and Visualizing Data with Microsoft Power BI",Bengaluru,Karnataka,India,backendFinal
Software Engineer II,Microsoft,4.8,"Django, C++, React.js, Git, C#, Microsoft SQL Server, Microsoft Azure, HTML5, Cascading Style Sheets (CSS), Bootstrap, Secure Shell (SSH), Amazon EC2",Bachelor of Technology - BTech,National Institute of Technology Durgapur,"Chapter Leader of Campus Chapter, Microsoft Certified Azure Certification Exam, Problem Solving (Intermediate) Skills Certification Test",Bengaluru,Karnataka,India,backendFinal
System Engineer,Tata Consultancy Services,2.6,"Azure cloud, Analytical Skills, Crack leaked password database, Android, JavaScript, Cloud Computing, Flutter, Dart, Microsoft Azure, Microsoft Excel, Django, Java, Algorithms, Microsoft Word, HTML, React.js, MySQL, Front-End Development, Communication, Engineering, Project Management, English, Python (Programming Language), Core Java, Microsoft PowerPoint, Hindi, HTML5, Cascading Style Sheets (CSS)",Bachelor of Technology - BTech,"SHRI RAMSWAROOP MEMORIAL COLLEGE OF ENGINEERING AND MANAGEMENT, LUCKNOW","Microsoft Certified: Azure Administrator Associate, Software Engineering Program, CSS, Introduction to Soft Skills, Java , TCS iON Career Edge - Young Professional, Web Development, AZ-900 Microsoft certified Azure Fundamentals, Core Java, Python and django ",Bengaluru,Karnataka,India,backendFinal
Software Engineer-II,Cloudera,4.6,"Distributed Systems, Hadoop, MapReduce, Java, Ruby on Rails, C (Programming Language), C++, Data Structures, Algorithms, Programming, DATA STRUCTURE, React.js, Node.js, MongoDB, Python (Programming Language), Django, HTML, Cascading Style Sheets (CSS)",Bachelor of Technology - BTech,Institute of Engineering and Technology,"Algorithms on Graphs, Algorithmic toolbox, Data Structures",Bengaluru,Karnataka,India,backendFinal
System Engineer,Tata Consultancy Services,2.2,"Data Structures, Open-Source Software, Computer Science, Database Management System (DBMS), Problem Solving, Database Design, SQL, Git, PHP, JavaScript, API, WordPress, Kotlin, Java, HTML, CSS, Network Address Translation (NAT), Cybersecurity, Network Security, Encryption, Routing, Internet Protocol (IP), Internet Protocol Suite (TCP/IP), Networking, Web Content Writing, DSA, Software Testing, C++, C (Programming Language), Android Development, Web Development, java, MySQL, GitHub, Cloud Computing, RESTful WebServices, Back-End Web Development, Application Programming Interfaces (API), API Development",Bachelor's degree,"C. V. Raman Global University, Bhubaneswar","Become a RESTful API Developer, Hands-On Introduction: JavaScript, Hands-On Introduction: PHP, JavaScript for Web Designers, Learning Cloud Computing: Core Concepts, Learning Git and GitHub, Practice It: PHP with MySQL, Introduction to Cybersecurity, Cybersecurity Essentials, CCNA: Enterprise Networking, Security, and Automation, CCNA: Switching, Routing, and Wireless Essentials, CCNA: Introduction to Networks",Bengaluru,Karnataka,India,backendFinal
Back End Developer,Basava Pracheena Vaidya Anveshana,3.6,"Back-End Web Development, DevOps, Application Programming Interfaces (API), Guiding, Java, HTML, Leadership, Engineering, Research, Data Structures, Algorithms, Programming, C (Programming Language), CSS, Cascading Style Sheets (CSS), SQL, Core Java, C++, Communication, Problem Solving, English, Kannada",Bachelor of Engineering - BE,Nagarjuna College Of Engineering and Technology,,Bengaluru,Karnataka,India,backendFinal
Engineering Manager,Gojek,15.4,"Java, Apache Flink, Apache Spark, Hadoop, Oozie, Scala, MapReduce, Hive, Apache Kafka, ElasticSearch, Golang, BigTable, Amazon Dynamodb, Kafka",Engineer’s Degree,"Jawaharlal Nehru Technological University, Anantapur",,Bengaluru,Karnataka,India,backendFinal
Software Engineer,TIFIN,3.5,"FastAPI, Dialogflow, GraphQL, NestJS, Django, AWS Lambda, Amazon Web Services (AWS), MongoDB, Redis, Git, Node.js, CI/CD, Python (Programming Language), Blockchain, TypeScript, Jenkins, C++, Programming, Technical Content Writing, Algorithms, Data Structures, Shell Scripting, Creative Writing, C (Programming Language), Java, HTML, JavaScript, Cascading Style Sheets (CSS), Ethereum",Bachelor of Technology - BTech,Indian Institute of Information Technology Kottayam,Blockchain Specialization,Bengaluru,Karnataka,India,backendFinal
java backend developer,Intuit,4.0,"Microservices, Core Java, JavaServer Pages (JSP), Java Database Connectivity (JDBC), Hibernate, MySQL, React.js, Responsive Web Design, Python (Programming Language), Web Development, Bootstrap, HTML5, AngularJS, Cascading Style Sheets (CSS), JavaScript, Angular",Master of Computer Applications - MCA,"Biju Patnaik University of Technology (BPUT), Rourkela",,Bengaluru,Karnataka,India,backendFinal
