current_position,current_company,years_of_experience,total_skills,education_degree,education_institution,certifications,city,state,country,profile_type
Senior Software Engineer,Stealth Startup,7.1,"Kubernetes, Kotlin, Performance Improvement, RDBMS, Terraform, Datadog, Go (Programming Language), Optimising, PostgreSQL, Computer Science, Cloud Services, REST APIs, Elasticsearch, Cassandra, Lua, Tidb, TypeScript, Python (Programming Language), AWS Identity and Access Management (AWS IAM), MongoDB, Redis, React.js, python, Amazon Web Services (AWS), Web Scraping, Scripting, Data Structures, Software Development, Programming, Jenkins, PHP, C, Microsoft PowerPoint, Java, HTML, docker, MySQL, Bitbucket, Slack , SQL, JavaScript, AWS Lambda, Pandas (Software), Amazon S3, Amazon CloudWatch, Amazon Simple Notification Service (SNS), AWS CloudFormation, Javascript, Node.js, Groovy, Data Wrangling, Amazon VPC, AWS EFS, Amazon EC2, Amazon SQS, Amazon Dynamodb",Bachelor of Engineering - BE,"M.KUMARASAMY COLLEGE OF ENGINEERING, KARUR","Docker for the Absolute Beginner - Hands On, Holistic Online New Age Skill Development Programme - Zeta, AWS Fundamentals: Going Cloud-Native, Java Tutorial",Bengaluru,Karnataka,India,backendFinal
Associate Engineer,Atos,3.1,"REST APIs, Spring Boot, jQuery, Hibernate, MySQL, Java, Spring MVC, Spring Framework, Debugging, Engineering, Communication, Analytical Skills, JavaScript, Python (Programming Language), Angular, SQL, HTML, Cascading Style Sheets (CSS), C (Programming Language), Web Development, Web Design, Web Applications, Back-End Web Development, Front-End Development, Microsoft Visual Studio Code",Bachelor of Engineering - BE,KNS Institute Of Technology,,Bengaluru,Karnataka,India,backendFinal
Software Development Engineer III,Zee Entertainment Enterprises Limited,7.1,"C++, C, Java, Python, R, MySQL, Machine Learning, Data Science, Data Structures, Algorithms, Deep Learning, Programming, Linux, HTML, Cascading Style Sheets (CSS), Python (Programming Language), Test Driven Development, Test-Driven Development",Master of Technology - MTech,"Indian Institute of Technology, Roorkee","Practical Test-Driven Development for Java Programmers, Get Started with Cloud Storage, Migrate MySQL data to Cloud SQL using Database Migration Service, Google Cloud Fundamentals: Core Infrastructure, Unit Testing and Test Driven Development in Python, Data Science, Deep Learning, And Machine Learning with Python",Bengaluru,Karnataka,India,backendFinal
BackEnd Developer,Senchola,0.6,"SQL, Java, React.js, Framer, Software Validation, Mainframe Testing, Analytical Skills, XML, JavaScript, MySQL, FIGMA, UI/UX design, CSS, HTML5",Bachelor of Engineering - BE,Anna University Chennai,"Deloitte Australia - Technology  Job Simulation, 21 days International development programme on Data science tools, Configuration Management and the Cloud, Troubleshooting and Debugging Techniques, Introduction to Git and GitHub, Using Python to Interact with the Operating System, Crash Course on Python",Thoothukudi,Tamil Nadu,India,backendFinal
Software Engineer 2,PayPal,6.4,"Java, Android Development, JavaScript, Project Management, Microsoft Office, HTML, C++",Bachelor of Technology (BTech),ABV-Indian Institute of Information Technology and Management,"The complete Java certification course, MATLAB OnRamp, Android development",Bengaluru,Karnataka,India,backendFinal
Senior Software Engineer,Tata Elxsi,4.4,"Software Development, DSA, Qt/Qml, Gitlab, Software Design, C++, Object-Oriented Programming (OOP), Qt, QML, Python",Bachelor of Engineering - BE,"P D A College of Engineering, GULBARGA",,Bengaluru,Karnataka,India,backendFinal
Senior Software Engineer,Sprinto,6.3,"React.js, JavaScript, Cascading Style Sheets (CSS), C++, Python, Python (Programming Language), Machine Learning, C (Programming Language)",Bachelor of Technology - BTech,College of Engineering Trivandrum,"Intro to Deep Learning, Intermediate Machine Learning, Intro to Machine Learning, The Complete JavaScript Course 2019 , Machine Learning A-Z™: Hands-On Python & R In Data Science, Responsive web design, Course Completion Certification(Responsive websites using HTML5 and CSS3), JavaScript Algorithms and Data Structures, Android Workshop course certificate, Introduction to Modern Application Developement, Problem Solving (Basic) Certificate",Bengaluru,Karnataka,India,backendFinal
Staff Software Engineer II,Blackhawk Network,10.1,"WhatsApp Chatbot, FastAPI, Amazon Bedrock, Anthropic Claude, Bitbucket, E-Commerce, Design Patterns, MongoDB, Team Leadership, Teamwork, Agile Development, Problem Solving, SQLAlchemy, Python, Flask, AWS IoT, JavaScript, iBatis, Oracle RTD, Servlets, JavaServer Pages (JSP), Java, Spring Boot, Amazon Web Services (AWS), Web Services, MySQL, Spring Framework, Oracle Database, HTML, servlet, jsp, javascript, Struts, RESTful WebServices, XML, JSON, JUnit, Java Database Connectivity (JDBC), JBoss Application Server, WebLogic, jpa, GitHub, ibatis, oracle rtd, Microservices, Gradle, Redis",Bachelor of Technology (B.Tech.),PBR Visvodaya Institute of Technology & Science,"MongoDB Java Developer Path, Artificial Intelligence Engineer, NPS2 Certified",Bengaluru,Karnataka,India,backendFinal
Software Engineer,"Lytx, Inc.",3.1,"API Development, Debugging, Jira, AWS CloudFormation, Google Cloud Platform (GCP), Computer Science, Systems Design, HTML5, Front-End Development, Scrum, Agile Methodologies, Problem Solving, Multithreading, Design Patterns, Object-Oriented Programming (OOP), Angular, Bitbucket, Algorithms, Modular Programming, GitHub, HTML, AWS Lambda, Amazon EC2, kafka, Redis, AWS SageMaker, New Relic, PostgreSQL, Data Architecture, PL/SQL, Unix, Linux, Maven, Git, Full-Stack Development, AngularJS, Cascading Style Sheets (CSS), REST APIs, Continuous Integration and Continuous Delivery (CI/CD), React.js, Programming Languages, TypeScript, Data Structures, Coding Experience, SQL, Cloud Services, Representational State Transfer (REST), Back-End Web Development, Web Applications, Version Control, High-Level Design, Low-Level Design, Database Applications, Software Implementation, Software Development, Python (Programming Language), Programming, NoSQL, MySQL, Nodejs, Databases, JavaScript, Node.js, MongoDB, Express.js, Amazon Web Services (AWS), Jenkins, Java, Java Database Connectivity (JDBC), Spring Framework, Spring MVC, Spring, Core Java, C++, C, Spring Boot, Microservices",Bachelor of Technology - BTech,Jb Institute Of Engineering and Technology,"Java Spring Framework 6 withSpring Boot 3, Python Programming",Bengaluru,Karnataka,India,backendFinal
Software Engineer,Philips,2.2,"Amazon Aurora, AWS Lambda, Classroom Management, Teaching, Leadership, Amazon Web Services (AWS), Aws Opensearch, Kafka, Java, Core Java, Spring Boot, Spring MVC, PostgreSQL, Material-UI, JavaScript, Cascading Style Sheets (CSS), HTML, Node.js, Express.js, Mongoose ODM, MongoDB, React.js, Oracle SQL Developer, MySQL, PL/SQL",Bachelor in technolgy,Jain (Deemed-to-be University),,Bengaluru,Karnataka,India,backendFinal
Developer,Craloft,0.8,"SDV, Seaborn, Matplotlib, Data Analysis & Preprocessing, File Handling, Machine Learning, Data Science, Teamwork, Collaborative Coding, Microsoft Visual Studio Code, Cascading Style Sheets (CSS), Computer Application Training, Pandas (Software), File Processing, Back-End Web Development, Data Analysis, File Management, Library Management, Java, Api, HTML5, css , Api , ASP.NET MVC, C#, HTML, css, GitHub, ASP.NET, Web Development, JavaScript, Node.js, Git, Gitlab, Python (Programming Language), n8n",Master of Computer Applications - MCA,Alliance University,"Foundations of User Experience (UX) Design, Python Project for Data Science, HTML, CSS, and Javascript for Web Developers, Teamwork Skills: Communicating Effectively in Groups, What is Data Science? ",Bengaluru,Karnataka,India,backendFinal
Senior Software Engineer,Mphasis,3.4,"Multithreading, Data Structures, Java Development, Algorithms, Object-Oriented Programming (OOP), Microservices, Unit Testing, Skill Development, Passionate about Work, Technical Requirements, Performance Tuning, Code Review, Software Development, Back-End Web Development, MongoDB, Spring Framework, MySQL, REST APIs, Spring Boot, SQL, Java, Project Management, Communication, Strategy, Problem Solving, Leadership, Creative Content Creation",Bachelor of Technology - BTech,College of Engineering Trivandrum,"MongoDB SI Associate , AZ-204 Exam Preparation: Developing Solutions for Microsoft Azure, Programming for everybody  University of Michigan, Python Programming : Beginner to Expert",Bengaluru,Karnataka,India,backendFinal
Back-end Developer,Hitachi,0.5,"Object-Oriented Programming (OOP), Computer Engineering, JavaScript, Software Development, Technical Discussions, Databases, Communication, Linux, Analytical Skills, Data Structures, C (Programming Language), Python (Programming Language), SQL, C++, HTML5, Data Analytics, Microsoft Excel",Master of Computer Applications - MCA,"Mount Carmel College, Palace Rd, Bengaluru",,Bengaluru,Karnataka,India,backendFinal
DevOps Engineer,TechIT Frame,3.3,"DevOps, Amazon Web Services (AWS), Jenkins, GitHub, docker, Terraform, k8s, Ansible, JSON, Bug Tracking, Back-End Web Development, Engineering Education, Product Adoption, Requirements Gathering, Web Application Development, Platform Development, Coding Practices, Java API, Eclipse, Product Naming, JavaScript, Hibernate, Microservices, NoSQL, Java Database Connectivity (JDBC), J2EE Web Services, Problem Solving, Java Development, REST APIs, Thymeleaf, MongoDB, Spring Boot, Java, Core Java, HTML, Cascading Style Sheets (CSS), Spring Framework",Bachelor of Engineering - BE,East West Institute Of Technology,,Bengaluru,Karnataka,India,backendFinal
Software Development Engineer II,Park+,4.0,"REST APIs, MongoDB, Go (Programming Language), Back-End Web Development, Django REST Framework, Apache Kafka, Magento, PHP, C++, Data Structures, Algorithms, Object-Oriented Programming (OOP), MySQL, Problem Solving, Database Management System (DBMS), Python (Programming Language)",Bachelor of Engineering - BE,"Government Engineering College, Modasa",,Hālol,Gujarat,India,backendFinal
Software Engineer,Nunify,2.2,"XML, Software Development, HTML, Node.js, React.js, PostgreSQL, Vue.js, Ruby on Rails,   DSA, Java, JavaScript, Cascading Style Sheets (CSS), HTML5, git",Advanced backend development,Crio.do,"python boot camp completion certificate , Advanced Backend Development",Bengaluru,Karnataka,India,backendFinal
Back End Developer,Regenesys,2.8,"NestJS, SQL, Node.js, PostgreSQL, mongo, JavaScript, TypeScript, Software Design, Engineering, Redis, MongoDB, REST APIs, Data structure , C++, Web Development, Problem Solving, Algorithms",Bachelor of Technology - BTech,Sagar Group (SIRT Bhopal) | Sagar Group of Institutions,"Data Structures and Algorithm, Node js course",Bengaluru,Karnataka,India,backendFinal
Staff Engineer,Rakuten Travel Xchange,14.3,"Microservices, Architectural Design, REST APIs, Micorservice, Data Architecture, Software Solution Architecture, Telemetry, IT Strategy, Engineering Management, People Management, PHP, JavaScript, MySQL, Programming, XML, HTML, CSS, Java, Microsoft Office, AJAX, C++, C, Microsoft Word, Windows, Eclipse, SOAP, Python (Programming Language)",Bachelor of Engineering (B.E.),B.T.L Institute of technology,,Bengaluru,Karnataka,India,backendFinal
Engineer,Commvault,3.4,"SQL, Solr, C#, Programming Languages, Data Structures, C (Programming Language), Python (Programming Language), MySQL, Android Development, CPP, Ui/ux, Ui Designing, Figma (Software)",Bachelor of Technology - BTech,Vellore Institute of Technology,"Microsoft Certified: Azure Fundamentals, Introduction to TensorFlow for Artificial Intelligence, Machine Learning, and Deep Learning, Python Project for Data Science, Python for Data Science, AI and Development, Tools for Data Science",Bengaluru,Karnataka,India,backendFinal
AI/ML intern,Edunet Foundation,0.2,"Python (Programming Language), Machine Learning, Convolutional Neural Networks (CNN), Front-End Development, Video Editing, Sales Growth, WAMP, Web Application Development, Information and Communications Technology (ICT), Artificial Intelligence (AI), College Applications, Agile Methodologies, Git, Linux Development, Computational Intelligence, English, JavaScript, Information Technology Training, Secondary Education, Computer Programming, Programming, Hands-on Technical Leadership, Software Coding, SQL, Teamwork, Computer Science Education, Customer Satisfaction, Easily Adaptable, C++, Chrome DevTools, Red Hat Enterprise Linux (RHEL), Inventory Optimization, Sales Strategy, Creative Problem Solving, Customer Experience, Time Management, Team Leadership, React.js, Software Development Tools, Communication, Reducing Operating Costs, Database Management System (DBMS), Software Development, Software Development Life Cycle (SDLC), Web Development, Project Management, Project Planning, Project Engineering, Data Structures, Problem Solving, Microsoft Office, HTML, Java, C (Programming Language)",bachelor of computer applications,Acharya Institute Of graduate studies,,Bengaluru,Karnataka,India,backendFinal
Back End Developer,Turbostart,6.1,"LangChain, LangGraph, Go (Programming Language), Google Cloud Platform (GCP), PostgreSQL, Tailwind CSS, Next UI, Redux, Redux Toolkit, Docker, AngularJS, Mean Stack, FastAPI, Nextjs, Amazon Web Services (AWS), Nginx, Problem Solving, Back-End Web Development, Databases, SCSS, API, React.js, MERN Stack, Git, GitHub, Next.js, Cascading Style Sheets (CSS), Node.js",Bachelor of Technology - BTech,Galgotias University,"Build and Secure Networks in Google Cloud, Deploy and Manage Cloud Environments with Google Cloud, Deploy to Kubernetes in Google Cloud, Engineer Data in Google Cloud, Explore Machine Learning Models with Explainable AI, Getting Started: Create and Manage Cloud Resources, Insights from Data with BigQuery, Integrate with Machine Learning APIs, Perform Foundational Data, ML, and AI Tasks in Google Cloud, Perform Foundational Infrastructure Tasks in Google Cloud, Set up and Configure a Cloud Environment in Google Cloud, Step into Robotic Process Automation",Bengaluru,Karnataka,India,backendFinal
Python Developer,DTskill AI,1.7,"AWS SES, Amazon S3, Azure AI Studio, AWS Lambda, Jenkins, Amazon Web Services (AWS), Large Language Models (LLM), REST APIs, Django REST Framework, Docker , Microservices, Flask, FastAPI, Git, MongoDB, Beautiful Soup, Selenium WebDriver, Web Scraping, Java, Python, HTML5, Cascading Style Sheets (CSS), JavaScript, Django, Problem Solving, React.js",Bachelor of Technology - BTech,Dr. A.P.J. Abdul Kalam Technical University,"Python programming, Juspay Hiring Challenge 2022 (Certificate of Participation)",Bengaluru,Karnataka,India,backendFinal
Senior Associate Consultant,Infosys,4.9,"Spring Batch, Apache Kafka, Redis, PostgreSQL, Java, Java Development, Python (Programming Language), Flask, Git, Microservices, Jira Service Desk, MongoDB, Servlets, Spring Framework, Core Java, Spring Boot, Java servlets, JavaServer Pages (JSP), Jira, Java Database Connectivity (JDBC)",Bachelor of Engineering - BE,"Gandhi Engineering College (GEC), Bhubaneswar",Advanced Java,Bengaluru,Karnataka,India,backendFinal
Senior Consultant,"Neudesic, an IBM Company",14.8,"Software Development, Management, Microsoft Office, Business Analysis, Requirements Analysis, Logistics Management, Third-Party Logistics (3PL), Health Insurance, Warehouse Operations, Inventory Management, Purchase Management, Sales Management, Analytical Skills, Agile Methodologies, Front-end Development, SQL, .NET Core, GitHub, Bitbucket, Jira, REST API, AngularJS, C#, .NET Framework, ASP.NET, REST APIs, Leadership, Continuous Integration and Continuous Delivery (CI/CD), Atlassian Suite, Confluence, Onsite-Offshore co-ordination, Agile Application Development, Agile Web Development, .Net Core, Angular, PostgreSQL, Microservices, Visual Studio, WinForms, Azure DevOps Server, Microsoft Teams, TFS, Cloud Computing, Microsoft Azure, Azure Service Bus, Emotional Intelligence, Coding Practices, Public Speaking, Azure DevOps, Cloud Development",Master's degree,Annamalai University,"Microsoft Certified: Azure Fundamentals, Developing CI/CD Solutions with Azure DevOps, Communicating with Confidence, Developing Your Emotional Intelligence, Ten Tips for the C# Developer, Azure Service Bus, Agile Foundations",Cochin,Kerala,India,backendFinal
Java Developer,Myulogic Solutions Pvt Ltd,4.6,"Oracle Database, Django, Django REST Framework, Pyrhon, Geographic Information Systems (GIS), GIS Applications, GIS Modeling, GeoPandas, Geopanda, Back-End Web Development, Databases, Relational Databases, Maven, Algorithms, Data Structures, Representational State Transfer (REST), Object-Oriented Programming (OOP), Model-View-Controller (MVC), Java Virtual Machine (JVM), REST APIs, Programming Languages, Programming, Debugging, XML, Test Cases, Hypertext Transfer Protocol (HTTP), Eclipse, Core Java, Microservices, J2EE Web Services, Servlets, Java, J2EE Application Development, j2ee, Spring Framework, Spring MVC, Spring Boot, Spring Security, Spring Data, Hibernate, Java Database Connectivity (JDBC), SQL, MongoDB, Design Patterns, GitHub, JUnit, HTML5, Cascading Style Sheets (CSS)",Bachelor of Engineering - BE,kls vdit haliyal,,Bengaluru,Karnataka,India,backendFinal
Python full stack Developer,MINTU  INSTITUTE  OF TECHNOLOGIES,0.8,"React.js Frameworks, SQL , Back-End Web Development, Front-End Development",BSC,"Sri Krishnadevaraya University (SKU), Anantapur",,Bengaluru,Karnataka,India,backendFinal
Software Engineer,Wissen Technology,4.8,"React.js, Front-End Development, Spring Data, RDBMS, Core Java, Spring Framework, Problem Solving, Object-Oriented Programming (OOP), MySQL, Back-End Web Development, Spring Boot, Cascading Style Sheets (CSS), HTML5, Data Structures, JavaScript, Strategy, SQL, java, Manual Testing",Bachelor of Engineering - BE,Sahyadri College of Engineering & Management,,Bengaluru,Karnataka,India,backendFinal
Software Engineer,Multipli.fi,3.9,"HAProxy, NestJS, Postman API, nodejs, React.js, docker, Operating Systems, Database Management System (DBMS), Computer Networking, Software Project Management, Django REST Framework, PostgreSQL, Nginx, Amazon Web Services (AWS), Node.js, MongoDB, Apache Kafka, Redis, Jira, Django, Python (Programming Language), Adobe Photoshop",Bachelor of Technology - BTech,"AJAY KUMAR GARG ENGINEERING COLLEGE, GHAZIABAD",,Bengaluru,Karnataka,India,backendFinal
Software Engineer,Tekion Corp,7.2,"PHP, java script, jQuery, Django, Bootstrap, Ajax, MySQL, Joomla, HTML5, Cascading Style Sheets (CSS), MySQLi, Firebase, React Native, Java, Sterling Commerce, Node.js, GitHub, MongoDB, Back-End Web Development, Jenkins, Express.js, AngularJS, Redis",BTech - Bachelor of Technology,SRM IST Chennai,"Advanced Node.js, Neural Networks And Deep Learning, Python,  Web Development ",Bengaluru,Karnataka,India,backendFinal
Software Engineer,ClickPost,3.2,"Web Applications, Version Control, Problem Solving, Git, Technical Documentation, Front-End Development, Databases, Python, Back-End Web Development, Spring Boot, Full-Stack Development, Amazon Web Services (AWS), AngularJS, Java, Python (Programming Language), Deep Learning, Robot Operating System (ROS), Machine Learning, Data Structures, content writing, C (Programming Language), C++, Embedded Systems, arduino, 8051 Microcontroller, Gazebo, Google Apps Script, Assembly language 8051, Algorithms, HTML, Cascading Style Sheets (CSS), Bootstrap, JavaScript, Node.js, Web Development, MongoDB, REST APIs, Postman",Bachelor of Technology - BTech,Institute of Engineering and Technology,"Certificate of Completion - Vargi Bots, Machine Learning, Neural Networks and Deep Learning, Programming, Data Structures and Algorithms Using Python",Bengaluru,Karnataka,India,backendFinal
Senior Software Engineer,Airstack,8.2,"GraphQL, AI Agents, ClickHouse, SQL, Jira, Jenkins, Git, Front-End Development, NoSQL, MongoDB, HTML, Cascading Style Sheets (CSS), TypeScript, React Native, Algorithms, Go (Programming Language), Java, JavaScript, Microservices, Machine Learning, Distributed Systems, Data Structures, Object-Oriented Programming (OOP), Systems Design, Spring Boot, Node.js, React.js, Representational State Transfer (REST), Ruby on Rails, WebLogic, WebSphere, Pandas, Python, Linux, PL/SQL, Enterprise JavaBeans (EJB), JSON, XML, j2ee, Model-View-Controller (MVC), IoT, Raspberry Pi, RDBMS, LLD, High Level Design",Bachelor of Technology (B.Tech.),National Institute of Technology Raipur,"Machine Learning Foundations: A Case Study Approach, Python for Data Science and Machine Learning Bootcamp, VLSID-SoC & Micro-nano Technology, Raspberry Pi, Embedded System and Robotics",Bengaluru,Karnataka,India,backendFinal
SDE,Razorpay,3.1,"Distributed Systems, Microservices Architecture, Event-Driven Systems, Observability, Cloud-Native Architecture, Go (Programming Language), Amazon SQS, PHP, PHP Frameworks, PHP Applications, MySQL, PHPUnit, Laravel, GORM, Gin, Grafana, Superset, Kubernetes, Event Driven Programming, FinTech, Agile Methodologies, Design Guidelines, Model-view-viewmodel (MVVM), JSON, Code Review, IT Infrastructure Operations, Web Applications, Mockito, JUnit, Debugging, Spring Boot, RabbitMQ, Novu, Gradle, Maven, CI, Apache Kafka, API Development, Microsoft Visual Studio Code, IntelliJ IDEA, Ruby on Rails, Secure Shell (SSH), PostgreSQL, Micronaut, Kotlin, C++, Data Analysis, Data Structures, Algorithms, Electronics, Instrumentation, Microsoft Office, Java, MATLAB, Simulink, Problem Solving, HTML, Cascading Style Sheets (CSS), Microsoft Excel, C (Programming Language), Leadership, SQL, Database Administration, Database Design, Database Development, Front-end Development, Web Design, Object-Oriented Programming (OOP), Web Development, Programming Languages, JavaScript, React.js, REST APIs, Bootstrap",Bachelor of Technology - BTech,"Indian Institute of Technology (Indian School of Mines), Dhanbad","HTML Essential Training, Programming Foundations: Databases, Machine Learning A-Z™: Hands-On Python, Algorithmic Toolbox, Problem Solving (Basic) Certificate",Bengaluru,Karnataka,India,backendFinal
Senior Software Development Engineer,Hitachi Vantara,8.2,"LlamaIndex, Langchain, GenAI, Python (Programming Language), Express.js, RESTful WebServices, React.js, Amazon Dynamodb, Apollo GraphQL, Amazon Web Services (AWS), GraphQL, TypeScript, Node.js, Angular 8, Mulesoft, SQL, Representational State Transfer (REST), JavaScript, REST API, RAML, Anypoint Studio, Cascading Style Sheets (CSS), Git",Master of Computer Applications - MCA,Assam Engineering College,"Operators, Arrays, & Functions, Certified SAFe® 5 Practitioner, MCD- Integration and API Associate(Mule 3.9)",Bengaluru,Karnataka,India,backendFinal
Backend Engineer ,Deel,8.5,"Database Modeling, Redis, MongoDB, Node.js, Amazon S3, SQL, Multi-Tenant Management, C, Java, C++, Python, JavaScript, Machine Learning, Data Mining, Algorithms, React.js, Amazon Dynamodb, HTML5, Cascading Style Sheets (CSS), Bootstrap",Bachelor of Technology,Dhirubhai Ambani University,,Bengaluru,Karnataka,India,backendFinal
Software Engineer,Victoria’s Secret & Co.,6.2,"Golang, MongoDB, CouchDB, Microservices, Badgerdb, Apache Kafka, Blockchain, Protocol Buffers, gRPC, Python (Programming Language), C (Programming Language), Go (Programming Language), Project Management, Machine Learning, Cloud Computing, Git, Docker, Linux, C++, Java, MySQL, Teamwork, Leadership, Management, Amazon EC2, REST APIs, Data Structures",Bachelor of Engineering,"Bapuji Institute of Engineering & Technology, DAVANAGERE","gRPC[Golang] Master Class, Protocol Buffers, Blockchain in Supply chain management , Golang, Golang, Problem Solving, Docker for the Absolute Beginner , Python(Basic), Regular Expression Course for Beginners , Machine Learning, Implementing a Full CI/CD pipeline",Bengaluru,Karnataka,India,backendFinal
Consultant,Infosys,7.6,"REST APIs, Microservices, Oracle SQL Developer, JavaServer Pages (JSP), HTML, JavaScript, IBM UrbanCode Deploy (uDeploy), Spring Framework, Core Java, SQL, Agile Methodologies, Object-Oriented Programming (OOP), C, Unix, Cascading Style Sheets (CSS), Spring Boot, Spring MVC, Oracle Database, RESTful WebServices, Jakarta EE, Management, Decision-Making, Public Speaking",BTech - Bachelor of Technology,JIS College of Engineering,"Analyzing and Visualizing Data with Microsoft Power BI,  Business Analysis Fundamentals, Microsoft certified Azure Fundamentals, Oracle Certified Professional, Java SE 8 Programmer II, Oracle Certified Associate, Java SE 8 Programmer, Big data with Hadoop",Bengaluru,Karnataka,India,backendFinal
Senior Software Engineer,Infinite Computer Solutions,4.7,"Node.js, MongoDB, Mongoose OS, React.js, awslambda, Express.js, Data Mining, Social Media Mining, Microsoft PowerPoint, Microsoft Office, Microsoft Excel, Microsoft Word, SQL, Microsoft Power BI, Intellectual Property",Bachelor of Technology - BTech,"Maulana Abul Kalam Azad University of Technology, West Bengal formerly WBUT",,Bengaluru,Karnataka,India,backendFinal
