current_position,current_company,years_of_experience,total_skills,education_degree,education_institution,certifications,city,state,country,profile_type
Blockchain Developer,WeMoveIdeas India,5.8,"Git, Back-End Web Development, GitHub, API Development, Amazon Web Services (AWS), REST APIs, Blockchain, Java, JavaScript, Node.js, C, Hyperledger, Solidity, SQL, HTML, Cryptocurrency, Ethereum, MongoDB, Bitcoin, Linux, Windows, Programming, Research, MySQL, Smart Contracts, Crypto, Decentralized Applications (DApps), C#, ASP.NET MVC, Agile Methodologies",Bachelor of Technology - BTech,"Sree Vidyanikethan Engineering College, A.Rangampet, Tirupati.","Corda Certified Developer, Certified Blockchain Developer, IBM Blockchain Essentials, IBM Blockchain Foundation Developer",Bengaluru,Karnataka,India,blockchain_developers
Blockchain Developer,KoinBX,0.7,"Blockchain, Blockchain Architecture, Public Key Cryptography, Node.js, Back-End Web Development, Python (Programming Language)",,,,Bengaluru,Karnataka,India,blockchain_developers
SDE,JPMorgan Chase & Co.,5.8,"Nonprofit Volunteering, Voluntary Sector, AWS Lambda, Amazon ECS, Amazon Web Services (AWS), Cloud Computing, Python (Programming Language), MongoDB, Tailwind CSS, Continuous Integration and Continuous Delivery (CI/CD), Cloudflare, JavaScript, TypeScript, Three.js, Svelte, Electron.js, React.js, Full-Stack Development, Node.js",Bachelor of Engineering - BE,"Dayananda Sagar College of Engineering, BANGALORE","AWS Certified Developer – Associate, AWS Certified Cloud Practitioner, Software Engineering Virtual Experience,  The Complete 2021 Web Development Bootcamp , Programming for Everybody (Getting Started with Python), The Bits and Bytes of Computer Networking, Technical Support Fundamentals, Google Ads , GCP Essentials",Bengaluru,Karnataka,India,blockchain_developers
SDE 2,Acko,7.1,"C++, Nodejs, Java, MySQL, HTML5, Cascading Style Sheets (CSS), PHP, Microsoft Office, SQL, JavaScript, Bootstrap, git, Blockchain, Solidity, Leadership, Team Management, Public Speaking, Jet cookbook, Gitlab, PostgreSQL, decentralized exchange, Node.js",Bachelor of Engineering,"Institute of Engineering & Technology DAVV, Indore","ACM ICPC online round, Codechef SNACKDOWN 2016, Codechef SNACKDOWN 2017, Computer Programming, IBM Blockchain Essentials, Introduction To Virtualization",Bengaluru,Karnataka,India,blockchain_developers
Blockchain Content Curator,Ticker,1.8,"Go (Programming Language), Rust (Programming Language), Blockchain, Smart Contracts, Ethereum, Marketing Analytics, Microsoft Excel, Writing, English",Bachelor of Engineering - BE,CHANDIGARH UNIVERSITY,,Bengaluru,Karnataka,India,blockchain_developers
Blockchain Developer,Codegene,4.5,"Ether.js, web3.js, React.js, Blockchain, JavaScript, Solidity, Java, Ethereum, Cascading Style Sheets (CSS), HTML, Python (Programming Language)",Bachelor of Technology - BTech,RR Institute Of Technology,,Bengaluru,Karnataka,India,blockchain_developers
Blockchain Developer,Sustainability Economics,3.2,"Artificial Intelligence (AI), Solution Architecture, Web3, Smart Contracts, Cryptocurrency, Software Development, Ethereum, JavaScript, Solidity, Blockchain, Node.js",Bachelor of Engineering - BE,Savitribai Phule Pune University,,Bengaluru,Karnataka,India,blockchain_developers
Software Engineer E3,ChainSafe Systems,7.4,"Rust (Programming Language), Go (Programming Language), Oracle SQL Developer, Data Structures, Algorithms, Software Development, Database Design, Stategic Planning, C, C++, Python (Programming Language), React, Unix, Linux, Microsoft SQL Server, Git, C (Programming Language), Team Management, Leadership, Full-Stack Development",Bachelor of Engineering (B.E.),Sir M Visvesvaraya Institute Of Technology,,Bengaluru,Karnataka,India,blockchain_developers
Software Engineer,CDN Solutions Group,4.2,".NET Core, ASP.NET Core, ASP.NET MVC, Non-Fungible Tokens (NFTs), Solidity, Web3, React.js, web3.js, Blockchain, Dart, Rust (Programming Language), C++, Python (Programming Language), SQL, Object-Oriented Programming (OOP), Microsoft SQL Server, HTML5, C#, .NET Framework, Model-View-Controller (MVC)",Bachelor of Technology - BTech,Technocrats Institute Of Technology,,Bengaluru,Karnataka,India,blockchain_developers
Senior Software Engineer,crypto startup,13.3,"Systems Engineering, Full Stack Developer, Research n Development, Blockchain Technology, Collaborative Learning, Excellent Coding Skills, Spring Boot, Kafka, RabbitMQ, Redis, Research and Development (R&D), Design Patterns, Microservices, MongoDB, NoSQL, TypeScript, C (Programming Language), MySQL, Ethereum, AngularJS, Smart Contracts, Spring Framework, JavaScript, Hyperledger, Node.js, Solidity, Python (Programming Language), Corda, MultiChain Platform, Java, Bitcoin, Cryptocurrency, Cryptography, Agile Methodologies",Bachelor of Engineering - BE,Government Jobs,,Bengaluru,Karnataka,India,blockchain_developers
,,,"Cryptography, Blockchain, Project Management, Presentations, Software Project Management, English, Communication, Web Development",Bachelor of Technology - BTech,Presidency University Bangalore,Blockchain basics,Bengaluru,Karnataka,India,blockchain_developers
Blockchain Developer,Finvault,6.0,"Web3, JavaScript, Solidity, Data Analysis, Financial Analysis, Financial Modeling, Algorithmic Trading, Python, C++, R, Machine Learning, Deep Learning, Stock Market Analysis, Foreign Exchange (FX) Trading, Microsoft Office, Day Trading, Quantitative Finance, Technical Analysis, Fundamental Analysis, Leadership, C, Quantum Computing, Quantum Information, Blockchain, Ethereum, Blockchain Architecture, Smart Contracts",Bachelor’s Degree,Dayanand Sagar College of Engineering,"Expert Solidity Bootcamp, Blockchain and Solidity Development, Architecture, Algorithms, and Protocols of a Quantum Computer and Quantum Internet, Professional Certificate - Quantum 101: Quantum Computing & Quantum Internet, The Hardware of a Quantum Computer, FOREX Basics, Python for Financial analysis and Algorithmic Trading, Stock Market Foundations, Top Machine Learning Libraries in Python",Bengaluru,Karnataka,India,blockchain_developers
BD Associate,Levitate Labs,3.0,"Web3, Blockchain, React.js, Node.js, formik, MongoDB, Tailwind CSS, HTML5, css3, JavaScript, Microservices, C (Programming Language), Java, MySQL, Engineering, C++, HTML, Turbo C, Cybersecurity, c programming, Cyber Security, Microsoft Office",Bachelor of Engineering - BE,"R. C. Patel Institute of Technology, Shirpur","Cybersecurity Fundamentals , Core Java , Networking , C Programming",Bengaluru,Karnataka,India,blockchain_developers
Blockchain Developer,Block Stack,8.4,"Decentralized Applications (DApps), Metaverse Development, Data Analysis, Smart Contract Architecture, Blockchain Development, Go (Programming Language)",Bachelor's degree,"Integral University, Lucknow, Uttar Pradesh",,Bengaluru,Karnataka,India,blockchain_developers
Blockchain Developer,ST Labs,9.6,"Engineering, English, Research, Communication, Consulting, Financial Services, Web Development, PL/SQL, Python (Programming Language), PHP, PhpMyAdmin, WordPress, Java, JavaScript, Adobe Premiere Pro, Natural Language Processing (NLP), GIMP, CorelDRAW, JavaServer Pages (JSP), Full-Stack Development, Responsive Web Design, Internet of Things (IoT), REST API, Weblogic Administration, Cascading Style Sheets (CSS), Digital Marketing, WebLogic, Application Programming Interfaces, Jira, Software as a Service (SaaS), Bootstrap, AJAX, Hibernate, Oracle Database, C++",Bachelor of Engineering - BE,Thakur College Of Engineering and Technology,Oracle Cloud Infrastructure Foundations 2020 Certified Associate,Bengaluru,Karnataka,India,blockchain_developers
Individual Contributor,"nevı° Kunden-Onboarding für GitLab, GitHub, Bitbucket & Co.",8.8,"Node.js, Solidity, Web3, web3.js, Python, C++, Shell Scripting, Linux, JavaScript, Operating Systems, Algorithms, C, Strategic Planning, Team Management, Entrepreneurship, Applied Probability, SQL DB2, Data Analytics",Bachelor's degree,ITM Group of Institutions,,Bengaluru,Karnataka,India,blockchain_developers
