current_position,current_company,years_of_experience,total_skills,education_degree,education_institution,certifications,city,state,country,profile_type
ML Engineer,Adobe,11.0,"Matlab, Electronics, C, C++, Electrical Engineering, English, Java, Programming, Simulink, Engineering, Microcontrollers, Labview, Simulations, Microsoft Word, PowerPoint, Pspice, Signal Processing, VHDL, Algorithms",Bachelor of Engineering (BE),Anna University,,Bengaluru,Karnataka,India,ml_engineer
Machine Learning Engineer,Sarvam,7.0,"Artificial Intelligence (AI), Machine Learning, Deep Learning, Natural Language Processing (NLP), Large Language Models (LLM), Text-to-Speech, Speech-to-Text, Artificial Intellig, Dalle, Data Analysis, Databases, Data Warehousing, Data Mining, Big Data, Data, Statistical Data Analysis, Data Modeling, Adobe Photoshop, Singer, Python, Guitar, Violin, Python (Programming Language)",BSc - Bachelor of Science,"St. Stephen's College, Delhi","4-Week Virtual Internship Program on Generative AI, Create Realtime Images through Voice using Generative AI Models, Blockchain Basics, Bachelor of Science in Mathematics (Honours Course), Complete Python Developer, Adobe Photoshop CC – Advanced Training Course, Indian School Certificate, Grade 8 Violin",Bengaluru,Karnataka,India,ml_engineer
Python Software Developer,Wipzent,3.1,"Artificial Intelligence (AI), Django, Pandas (Software), Flask, DSA, JavaScript, Java, Scientist of data analytics , Machine Learning, SQL, Python (Programming Language)",Bsc in data science ,Techno India University,,Bengaluru,Karnataka,India,ml_engineer
Machine Learning Engineer,Smart Data Solutions,9.2,"Semantic Search, Model Selection, Decision-Making, Documentation, Version Control, Exploratory Data Analysis, Scikit-Learn, Classification, Machine Tools, Unstructured Data, Programming, Unsupervised Learning, Supervised Learning, Statistical Data Analysis, Speech Analytics, Natural Language Processing (NLP), Problem Solving, Machine Learning, Python, SQL, Tableau, Data Analysis, Microsoft Excel, Microsoft Word, Microsoft Office, Unix, Oracle Database, Linux, Google Analytics, Team Leadership, Team Management, Public Speaking, Alteryx, NumPy, Data Analytics, Predictive Analytics, A/B Testing, Pandas",Predictive Analytics for Business ,Udacity,"SQL (Basic) Certificate, Databases for Developers: Next Level, Amelia V3 Certified Professional (ACP), Google Analytics Individual Qualification ",Chennai,Tamil Nadu,India,ml_engineer
Director - Applied AI,Krutrim,15.6,"Coaching, Responsible AI, Analytical Skills, Team Management, Technical Leadership, Large Language Models (LLM), Applied Sciences, Signal Processing, Matlab, Audio Processing, Acoustics, C, Algorithms, C++, Digital Signal Processing, Python, LaTeX, Machine Learning, Music Information Retrieval, Speech Recognition",Doctor of Philosophy (Ph.D.),Tampere University,"Neural Networks for Machine Learning, Machine Learning",Bengaluru,Karnataka,India,ml_engineer
Machine Learning Engineer 2,Rakuten India,6.5,"Large Language Models (LLM), Apache Kafka, ML, Google Cloud Platform (GCP), SHAP, EDA, Google BigQuery, Fine Tuning, BERT (Language Model), BART, XGBoost, Natural Language Processing (NLP), Roberta, Hidden Markov Models, FastAPI, Kubernetes, docker, Classification, Random Forest, Python (Programming Language), Machine Learning, Data Science, Data Analysis, Data Visualization, Matlab, C++, SQL, Logistic Regression, Regression Analysis, Deep Learning, Predictive Analytics, Analytical Skills, Artificial Intelligence (AI), Neural Networks, Machine Learning Algorithms, Decision Trees, Support Vector Machine (SVM), k-means clustering, K-Nearest Neighbors (KNN), Recommender Systems, MATLAB, Microsoft Excel",Bachelor of Technology - BTech,National Institute of Technology Jamshedpur,"SQL (Basic), SQL (Intermediate), Applied Data Science Capstone, Applied Data Science Specialization, Excel Skills for Business: Essentials, Machine Learning with Python, Neural Networks and Deep Learning, data science training program, Data Analysis with Python, Data Visualization with Python, Python for Data Science and AI",Bengaluru,Karnataka,India,ml_engineer
Senior Machine Learning Engineer,Red Hat,11.1,"Computer Vision, Machine Learning, embedded deep learning, Software Development, Programming, Software Engineering, Artificial Intelligence (AI), Deep Learning, C++, C, Eclipse, Embedded Systems, Linux, Embedded Software, Unix, Git, Jenkins, Python (Programming Language), TensorFlow, Caffe, Keras, PyTorch, IAR Embedded Workbench, Keil, onnx, C (Programming Language)",Master of Technology - MTech,Indian Institute of Science (IISc),"Introduction to Machine learning, Diploma in Asp.Net",Bengaluru,Karnataka,India,ml_engineer
Machine Learning Engineer,Giggso,2.3,"Marketing, Front-End Development, Java Database Connectivity (JDBC), Data Structures, Analytics, Exploratory Data Analysis, Communication, Data Analytics, Data Visualization, Model Training, Computer Vision, Machine Learning, Predictive Modeling, Deep Learning, Adobe Photoshop, Data Analysis, Analytical Skills, Data Science, Python (Programming Language)",Bachelor of Technology - BTech,PSNA College of Engineering and Technology,"Python , Google data analytics, Python, Microsoft Certified: Azure AI Engineer Associate, Java full stack developer",Coimbatore,Tamil Nadu,India,ml_engineer
Machine Learning Engineer,Apra Labs.,7.9,"MCP, Agentic AI, Retrieval-Augmented Generation (RAG), Computer Vision, Cloud, SaaS Development, Full-Stack Development, Natural Language Processing (NLP), Public Speaking",Bachelor of Technology,"International Institute of Information Technology,naya raipur",,Bengaluru,Karnataka,India,ml_engineer
,,,"C (Programming Language), Python (Programming Language)",Bachelor of Technology - BTech,Presidency University Bangalore,Imarticus certificate of completion ,Bengaluru,Karnataka,India,ml_engineer
Co-Founder & CEO,noether,3.7,"FastAPI, Deep Reinforcement Learning, TypeScript, Multivariable Calculus, LangChain, Firebase, Image Segmentation, Natural Language Processing (NLP), Language Modeling, Go (Programming Language), C#, Knowledge Graph Embeddings, Amazon Web Services (AWS), Deep Neural Networks (DNN), Mongoose ODM, Web Scraping, Data Engineering, PyTorch, Object Detection, Remote Sensing, Machine Learning, Python (Programming Language), TensorFlow, OpenCV, Convolutional Neural Networks (CNN), Keras",Bachelor of Technology - BTech,Vellore Institute of Technology,,Bengaluru,Karnataka,India,ml_engineer
Staff ML Compiler Engineer,Waymo,21.1,"MLIR, Team Management, Code Generation, Generative AI, Management, Pipeline Parallelism, ML Compilers, Search Quality, Search Infrastructure, Autotuning, Web Services, Compilers, Static Analysis, Programming Languages, Parallel Programming, High Performance Computing, Information Retrieval, Large-scale Data Analysis, Log Analysis, Classification, Search Engines, Search Engine Ranking, Search, Display Advertising, Video Advertising",Doctor of Philosophy (PhD),Princeton University,,Bengaluru,Karnataka,India,ml_engineer
Data Consultant, ,2.1,"Keras, PyTorch, Data Analytics, Backtesting, Network Deployment, Multilingual, Statistical Tools, Deployment Management, Case Studies, Google Cloud Platform (GCP), Big Data, Logistic Regression, Open Data, Data Entry, Natural Language Processing (NLP), ARIMA, Prediction Markets, Insulin, Data AI, Trend Forecasting, Time Series Analysis, Ad Optimization, Docker Products, Business Development Support, Wikis, Diabetes, SQL Tools, TensorFlow, Small Business IT Solutions, Prophet, Sentiment Analysis, Data Modeling, Scalable Web Applications, BMI, Statistical Analysis Tools, Predictive Modeling, Streams, FastAPI, Time Series Forecasting, Transformers, Healthcare Financing, Mining, Financial Forecasting, Computer Science Education, Mine Economics, Forecasting, Problem Solving, Pregnancy, Finance Domain, Data Wrangling, Deep Learning, Pandas (Software), Remote Locations, Modeling Tools, PostgreSQL, Supervised Learning, Git, Recommender Systems, Data Science, Statistics, Artificial Intelligence (AI), Machine Learning, Prompt Engineering, Scikit-Learn, Apache Spark, GitHub, Flask, Streamlit, Docker, SciPy, NumPy, pandas, Data Visualization, Matplotlib, Seaborn, Communication, Presentation Skills, Project Management, Python (Programming Language), Tableau, SQL, Microsoft Excel, Analytical Skills",Master of Science In Computer Science,Woolf,,Bengaluru,Karnataka,India,ml_engineer
Senior Engineer,Accenture in India,5.4,"Word Embeddings, Convolutional Neural Networks (CNN), Object Detection, TensorFlow, PyTorch, pytest, Flask, Pandas (Software), Deep Learning, Data Analysis, Analytical Skills, Microsoft Excel, Python (Programming Language), R, SQL, HTML5, Cascading Style Sheets (CSS), Problem Solving, English, Programming, Machine Learning, sql, Hindi, Malayalam",Master's degree,"Christ University, Bangalore",,Bengaluru,Karnataka,India,ml_engineer
Software Development Intern,Varahe Analytics Private Limited,0.6,"Flask, Matplotlib, Generative AI Tools, NumPy, Django, NoSQL, Back-End Web Development, Named Entity Recognition (NER), Artificial Intelligence (AI), Jupyter, Regression Analysis, XGBoost, Data Visualization, Big Data, Data Analysis, Data Analytics, Programming, Data Processing, Programming Languages, Cascading Style Sheets (CSS), HTML, Algorithms, Java, Git, GitHub, Web Scraping, Application Programming Interfaces (API), SQL, Deep Learning, Natural Language Processing (NLP), Data Science, C (Programming Language), Data Structures, Operating Systems, Machine Learning, C++, Database Management System (DBMS), Software Development, Problem Solving, Python (Programming Language), Object-Oriented Programming (OOP)",Bachelor's degree,Ramaiah Institute Of Technology,"Problem Solving (Basic), Python Basic",Bengaluru,Karnataka,India,ml_engineer
Expert Software Developer,BMW TechWorks India,9.6,"GENAI, Large Language Models (LLM), Machine Learning, R, Artificial Intelligence, Eclipse, C, SQL, Python, Java, AngularJS, Hadoop, Data Analytics, Data Science, Predictive Analytics, Internet of Things, Power BI, Grafana, Python (Programming Language), MySQL",B.Tech,Guru Gobind Singh Indraprastha University,"AMCAT Certified Business Analyst, AMCAT Certified Business Consultant, AMCAT Certified Data Processing Specialist, AMCAT Certified Design Engineer - Electronics and Semiconductors, AMCAT Certified Design Engineer - Electronics and Semiconductors, AMCAT Certified Engineering Trainee - Electronics and Semiconductor Engineering, AMCAT Certified Software Development Trainee, AMCAT Certified Software Engineer - IT Services, AMCAT Certified Software Engineer - Product",Bengaluru,Karnataka,India,ml_engineer
Lead Data Scientist - Data Sciences,Myntra,10.5,"ML System Design, Deep Learning, Machine Learning, Large Language Models (LLM), Data Science, Computer Vision, Image Processing, Digital Image Processing, On-Device AI, System on a Chip (SoC), Probabilistic Generative Models, Generative AI Tools, Computational Photography, Data Structures, Algorithms, Android Development, Software Development, Object-Oriented Programming (OOP), Shell Scripting, C++, C, Java, Operating Systems, Matlab, Eclipse, Python, Embedded Systems, Linux, Android, Unix, LaTeX, XML, CSS, SQL, HTML, MySQL, Core Java, Linux Kernel, Kernel Drivers, OpenCV, GTK, Python (Programming Language)",Bachelor’s Degree,Jadavpur University,,Bengaluru,Karnataka,India,ml_engineer
ML Engineer,Typeface,29.9,"Computer Vision, Software Design, Distributed Systems, Software Engineering, Agile Methodologies, Software Development, Cloud Computing, Scrum, Scalability, C#, Software Project Management, Microsoft CRM, Agile Project Management, .NET, C++, Algorithms, Object Oriented Design, Windows Azure, Web Services, Microsoft Azure",BS,"Indian Institute of Technology, Bombay","Deep Learning Specialization, Strategic Thinking - Building & Sustaining Competitive Advantage, Machine Learning: Clustering & Retrieval, Machine Learning Foundations: A Case Study Approach, Machine Learning: Classification",Bengaluru,Karnataka,India,ml_engineer
Senior Data Scientist,Amazon Web Services (AWS),9.2,"MLOps, Apache Spark, Amazon Web Services (AWS), Data Analytics, AWS Lambda, AWS SageMaker, Amazon ECS, Docker, Shell Scripting, Linux, Amazon Dynamodb, Amazon S3, PySpark, Fraud Detection, Pandas (Software), Microsoft Power BI, Dataiku DSS, Python, SQL, Tableau, Deep Learning, Machine Learning, Statistics, Big Data, Data Science, Python (Programming Language), TensorFlow, pandas, Keras, R, dataiku dss, Natural Language Processing (NLP), Scikit-Learn, Alation, NumPy, Exploratory Data Analysis, Classification, Neural Networks",Bachelor of Technology - BTech,Maharaja Surajmal Institute Of Technology,"Neural Networks and Deep Learning, Intro to Python for Data Science, R Programming, The Data Scientist’s Toolbox",Bengaluru,Karnataka,India,ml_engineer
Senior Software Engineer,Google,16.2,"C, Linux, Perl, Data Structures, UMTS, Shell Scripting, Software Development, OOP, Design Patterns, Web Design, Web Development, Machine Learning, Deep Learning, Unix Shell Scripting, C++, LTE, Solaris, MySQL, Unix, Core Java, XML, ClearCase, Embedded Systems, PHP, JavaScript, Java, SQL, Operating Systems, AJAX, HTML, Windows, C (Programming Language), Visual Basic, CSS, jQuery, Apache, Databases, JSON, 5G New Radio (NR), SNMP, Diameter, GNU Debugger, VxWorks, ATM, ACE, Gdb, L2/L3 protocols, IoT, Hosting, 5G",Master of Computer Applications (MCA),BIT Mesra Student-Industry Relations Cell,"Convolutional Neural Networks, Improving Deep Neural Networks: Hyperparameter Tuning, Regularization and Optimization, Structuring Machine Learning Projects, Neural Networks and Deep Learning, Generative AI with Large Language Models, AWS Machine Learning Engineer Nanodegree, Data Science Orientation, The Complete Ethical Hacking Course: Beginner to Advanced!, Grokking the System Design Interview, Complete Guide to TensorFlow for Deep Learning with Python, Neural Networks and Deep Learning, Machine Learning A-Z™: Hands-On Python & R In Data Science, Machine Learning",Bengaluru,Karnataka,India,ml_engineer
,,,"Communication, Analytical Skills",B.tech,Presidency University Bangalore,"AWS - Solutions Architecture Job Simulation, BCG - Strategic & Experience Design Job Simulation, Tata Group - Cybersecurity Analyst Job Simulation",Bengaluru,Karnataka,India,ml_engineer
Lead Engineer Data Science,Paytm,10.2,"Artificial Neural Networks, Python (Programming Language), PySpark, Project Management, Amazon Web Services (AWS), Data Science, Technical Leadership, Computer Science, Computer Vision, Natural Language Processing (NLP), Databases, Artificial Intelligence (AI), Team Motivation, Problem Solving, Data Management, Build Strong Relationships, Predictive Analytics, Feature Engineering, Project Teams, Data Preparation, Programming Languages, Data Strategies, Communication, Data Mining, Data Analytics, Forecasting, Tableau, Business Requirements, Risk Reporting, Analytical Skills, Analytics, R, C, Materials Science, Microsoft Excel, Metallurgy, Statistical Data Analysis, Statistical Inference, Causal Inference, Text Analytics, Microsoft Office, Engineering, PowerPoint, Microsoft Word, Core Java, Python, Programming, Java, SQL, Hadoop, Research, Data Analysis, SQL Server Integration Services (SSIS), Microsoft PowerPoint",Post Graduate Diploma in Business Analytics,"Indian Institute of Management, Calcutta","Data Analysis and Statistical Inference, edX Honor Code Certificate for The Analytics Edge",Bengaluru,Karnataka,India,ml_engineer
Senior Data Scientist,Walmart Global Tech India,7.2,"Computer Vision, OpenCV, Recommender Systems, Apache Spark, Scala, Go (Programming Language), Kubernetes, Reinforcement Learning, Causal Inference, A/B Testing, Algorithms, Java, Data Analysis, Python, Machine Learning, Artificial Neural Networks, Matlab, C++, Data Science, Statistics, Logistic Regression, SQL, Neuro-Linguistic Programming (NLP), Neural Networks, Deep Learning, C (Programming Language), Data Structures, Python (Programming Language)",Master's degree,"Indian Institute of Technology, Roorkee",,Bengaluru,Karnataka,India,ml_engineer
Senior Consultant,HCLTech,3.0,"Amazon Web Services (AWS), Artificial Intelligence (AI), LangChain, Large Language Models (LLM), React.js, streamlit , SQL, Data Analysis, Machine Learning, Front-End Development, Python (Programming Language), Customer Relationship Management (CRM), Market Research Project Management, Analog Circuits, Presentation Skills, Organizational & Writing Skills, Communication, Creative Problem Solving, Project Management, Marketing, Presentations, Leadership",Bachelor of Engineering - BE,B. M. S. College of Engineering,AWS Certified Data Engineer – Associate,Bengaluru,Karnataka,India,ml_engineer
Associate Machine Learning Engineer,Syncron,2.3,"Llama2, Whisper, Pyannote, Cascading Style Sheets (CSS), BrowserStack, Google Ads, On-Page Optimization, Canva, DALL-E, Ruby on Rails, Vue.js, Large Language Models (LLM), Next.js, PostgreSQL, GPT-3, OpenaAI, TensorFlow, PyTorch, Kubernetes, Jenkins, SQL, Computer Science, Google Analytics, Data Science, Information Technology, gradio, Artificial Intelligence (AI), Generative AI, openai, Natural Language Processing (NLP), Software Development, Deep Learning, Social Media Optimization (SMO), Data Structures, Linux System Administration, Amazon Web Services (AWS), Flask, Intel oneAPI, Teamwork, JavaScript, Node.js, python3, Adobe Illustrator, Wondershare Filmora, AWS Polly, MySQL, Data Analysis, C (Programming Language), Digital Marketing, Databases, Search Engine Optimization (SEO), HTML, HTML5, Java, Linux, Microsoft Word, Social Media Marketing, Python (Programming Language), R (Programming Language), Raspberry Pi, Arduino, Problem Solving, Database Management System (DBMS), Video Editing, Web Development, Scilab, Software Testing",Master of Computer Applications - MCA,"Christ University, Bangalore","AWS Academy Graduate - AWS Academy Cloud Foundations, Foundations of Prompt Engineering, Deep Learning & Neural Network Implementation, Digital Skills: Artificial Intelligence , Java (Basic), Problem Solving (Basic), Python (Basic), SQL (Basic), SQL (Intermediate), Introduction to Natural Language Processing, Virtual Internship Program - Generative AI, Attention Mechanism, Create Image Captioning Models, Encoder-Decoder Architecture, Generative AI Fundamentals, Introduction to Generative AI, Introduction to Large Language Models, Introduction to Responsible AI, Transformer Models and BERT Model, Virtual Internship Program - Week 1 - Generative AI, Virtual Internship Program - Week 2 - Generative AI, Create Realtime Images through Voice using Generative AI Models, AWS Certified Security - Specialty, CompTIA A+ Core 1: Networking Fundamentals, Data Science Foundations, Introduction to Deep Learning, Networking Standards and Connections, Networking & Web Technology, Introduction to Artificial Intelligence, Linux Shell Programming, Problem Solving Using Computational Thinking, Programming Fundamentals: Introduction to Programming, Google Analytics",Bengaluru,Karnataka,India,ml_engineer
Data Science Intern,Luminar Technolab,2.9,"Automation, Sensors, Output Management, Production Management, Mechatronics, Robotics, Robotic Process Automation (RPA), Soft Computing, Sensors and Actuators, Supervised Learning, power bi, Convolutional Neural Networks (CNN), Recurrent Neural Networks (RNN), OpenCV, yolo, Retrieval-Augmented Generation (RAG), Computer Vision, Microsoft Word, PyTorch, Neuro-Linguistic Programming (NLP), Snowflake, EDA, Keras, Neural Networks, Deep Reinforcement Learning, Machine Learning Algorithms, Task Management, Microsoft PowerPoint, Business Analysis, Microsoft Outlook, Microsoft Office, Scikit-Learn, Pandas (Software), Statistics, Deep Learning, Word Embeddings, Vector, GPT-4, TensorFlow, BERT (Language Model), Natural Language Processing (NLP), Data Engineering, Quality Analysis, Pattern Recognition, Predictive Analytics, Feature Engineering, Mathematics, Databases, Data Warehousing, Data Analytics, Transact-SQL (T-SQL), DAX, Research Skills, Machine Learning, Analytical Skills, Financial Analysis, Large Language Models (LLM), Large Language Model Operations (LLMOps), Algorithms, Extract, Transform, Load (ETL), Data Quality, Data Modeling, Data Visualization, Visualization, Analytics, Dashboards, Python, SQL, Amazon Web Services (AWS), MySQL, Google BigQuery, Data Analyst, Data Science, Microsoft Power BI, Artificial Intelligence (AI), Python (Programming Language), Teamwork, Time Study, Project Control, Multitasking, Skilled Multi-tasker, Technical Communication, Programming, English, Communication, Project Management, Problem Solving, Leadership, Microsoft Excel, Data Analysis, Data Entry, Critical Thinking, Interpersonal Skills, Technology Management",Bachelor of Technology - BTech,APJ Abdul Kalam Technological University,Data Science - Python,Bengaluru,Karnataka,India,ml_engineer
Senior Project Coordinator,IndiaSpeaks Research Labs,3.4,"IT Business Analysis, Statistical Data Analysis, Customer Relationship Management (CRM), Data Science, Project Management, Multiple Project Coordination, Paperwork, Service-Level Agreements (SLA), Accounting, Management Information Systems (MIS)",Postgraduate Degree,Imarticus Learning,,Chennai,Tamil Nadu,India,ml_engineer
Senior Growth Data Scientist,CARS24,9.2,"Data Visualization, Data Services, Financial Economics, Data Loading, Business Analysis, AIML, Presentations, Presentation Skills, Model Development, Distributed Computing, Data Manipulation, Business Requirements, Analytical Solutions, Data Products, SolidWorks, C, C++, Microsoft Office, PowerPoint, Microsoft Word, Microsoft Excel, Management, Chemistry, Mathematics, Physics, Core Java, Sales Operations, MySQL, AutoCAD, Python (Programming Language), Machine Learning, SQL, Artificial Intelligence (AI), Programming, Data Science, Event Planning, Automation, ArcGIS Products, PostgreSQL, Artificial Neural Networks, Data Analytics, Teamwork, Computer Vision, Web Services API, REST API",Bachelor of Technology (B.Tech.),Delhi College of Engineering,"CutShort Certified Python - Advanced, Coursera : Crash Course on Python, Problem Solving, Python, REST API (Intermediate), Machine Learning Internship, Wheebox Employability Skills Test Certificate, AutoCad, Core Java, Solidworks",Delhi,Delhi,India,ml_engineer
Principal Analyst,Factspan,7.7,"Convolutional Neural Networks (CNN), Kinematics, 3R Manipulator, Robot Operating System (ROS), Chatbot Responses, SLAM, Camera Calibration, Tkinter, subprocess, Calibration, Machine Learning, Python (Programming Language), Deep Learning, Computer Vision, Image Processing, Data Structures, Data Science, MLOps, Object Detection, Optical Character Recognition (OCR), Image Dataset Preparation, Object Segmentation, PyTorch, Tableau, Deep Neural Networks (DNN), Data Analytics, Root Cause Analysis, Agile Methodologies, Scrum, C++, Matlab, SQL, Natural Language Processing (NLP), Robotics, Keras, TensorFlow, Predictive Modeling",Master of Technology - MTech,"Birla Institute of Technology and Science, Pilani","Python(Basic), Applied Data Science Capstone, IBM Data Science, Computer vision Basics, Machine Learning, AI for Everyone, Object oriented programming using C++, programming in C",Bengaluru,Karnataka,India,ml_engineer
IXP Intern,SAP,2.9,"SAP ERP, SAP, Microsoft Azure, Product Development, Web Scraping, Graph Networks, attacks, Image Processing, MATLAB, Probabilistic Models, Data Analysis, API, Cloud Computing, Amazon Web Services (AWS), Computer Networking, Java Certified Programmer, Attention Mechanisms, Content Creation, Intrusion Detection, Artificial Intelligence (AI), Graph Algorithms, Computational Intelligence, Gene Targeting, Java, Java Swing, SQL, Generative AI, Generative Adversarial Networks (GANs), C (Programming Language), Lexical Semantics, Natural Language Processing (NLP), Computer Vision, Convolutional Neural Networks (CNN), Artificial Neural Networks, Deep Learning, Python (Programming Language), Machine Learning, Digital Marketing, Google Ads, Online Marketing Analysis, Analytical Skills, Communication, Networking, Engineering, Data, Debate, Creative Writing, Book Writing, English, German",Bachelor of Technology - BTech,Amrita Vishwa Vidyapeetham,"CS50’s Introduction to Artificial Intelligence with Python, Image Processing Onramp, AWS Academy Introduction to Cloud, Introduction to Computer Vision and Image Processing, Introduction to Deep Learning & Neural Networks with Keras, Machine Learning with Python, CS50’s Introduction to Computer Science, Fundamentals of Digital Marketing, Introduction to Data Science, Introduction to IoT",Bengaluru,Karnataka,India,ml_engineer
