current_position,current_company,years_of_experience,total_skills,education_degree,education_institution,certifications,city,state,country,profile_type
Assistant Professor,"Christ University, Bangalore",10.1,"Applied Mathematics, Analytical Skills, Statistical Data Analysis, Data Visualization, MATLAB, Python (Programming Language), MySQL, LaTeX",Doctor of Philosophy - PhD (pursuing),Visvesvaraya Technological University,"Lean Six Sigma Green Belt, Lang chain with python bootccamp, Building interactive dashboards, Python basics for data science bootcamp, Preparatory course on Data Science, Executive PG Programme in Data Science",Bengaluru,Karnataka,India,ml_engineer
Technical Coordinator,The Scalers 🚀,21.3,"Dashboard Building, Business Analysis, Communication, Curriculum, Data Analytics, English, TensorFlow, Analytical Skills, Seaborn, GitHub, Amazon Web Services (AWS), docker, Flask, Statistical Data Analysis, EDA, Feature Engineering, NumPy, scikit learn, Machine Learning, Data Analysis, Pandas (Software), MongoDB, Heroku, pandas, Mathematics Education, Physics, Chemistry, Computer Science, Social Sciences, Python (Programming Language), Cascading Style Sheets (CSS), HTML5, Bootstrap, Web Hosting, Web Services, Microsoft Office, Microsoft Excel, Human Resources, HTML, JavaScript, C, MySQL, SQL, CSS, PHP, Dreamweaver, TEACHING, Python, HR Management, Management, Windows, Programming",Bachelor’s Degree,Dr. A.P.J. Abdul Kalam Technical University,Full Stack Data Science Bootcamp,Bengaluru,Karnataka,India,ml_engineer
Co-Founder and CTO,MarianaAI,7.2,,Bachelor of Engineering - BE,"Birla Institute of Technology and Science, Pilani",,Bengaluru,Karnataka,India,ml_engineer
Lead Data Scientist,Publicis Sapient,9.2,"SQL, Amazon Web Services (AWS), Artificial Intelligence (AI), AI Engineer, Langchain, FastAPI, Extract, Transform, Load (ETL), Kubernetes, LLMOps, E-Commerce, Project Management, User Experience (UX), Creative Pitching, Exploratory Data Analysis, Data Modeling, Python (Programming Language), Data Science, Assistant Teaching, Object Detection, Jetson, Microsoft Azure, Model Deployment, Computer Vision, Natural Language Processing (NLP), Predictive Modeling, MLOps, ML Engineering, Data Engineering, Large Language Models (LLM), Entrepreneurship, Machine Learning, Data Analysis, Python, Deep Learning, Generative AI",Bachelor of Engineering - BE,Bharati Vidyapeeth,One Month Product Management,Pune,Maharashtra,India,ml_engineer
Machine Learning Scientist - 2,Coursera,8.1,"Microsoft Word, Microsoft PowerPoint, Mechanical Engineering, Aeronautics, Aerospace, Cosmology, Astronomy, ANSI C, Siemens NX, Data Mining, Statistics, content writing, Creative Writing, Aerospace Engineering, Astrospace, Python (Programming Language), CATIA, Physics, Writing, Research, SolidWorks, ANSYS, Finite Element Analysis (FEA), Computational Fluid Dynamics (CFD), Telescope, Enclosure Design, Engineering Drawings, Batteries, Electrical Engineering, Digital Signal Processing, Steering, C (Programming Language), Machine Learning, Keras, TensorFlow, Django, Deep Learning, Neural Networks, Image Processing, Convolutional Neural Networks (CNN), Computational Neuroscience, C++",BTech - Bachelor of Technology,Aligarh Muslim University,,Bengaluru,Karnataka,India,ml_engineer
Consultant II - Analytics and Data Sciences,Eli Lilly and Company,11.0,"Agentic AI, Kore.AI, Machine Learning, Blue Prism, Leadership, Uipath, Microsoft Office, Python, Automation Anywhere, Microsoft Power BI, Blue Prism ,Uipath, Python, DBMS, Uipath, IBM MQ, SQL",Mtech in Artificial Intelligence and Machine Learning ,"Birla Institute of Technology and Science, Pilani","A2019 Advance Certification , A360 Master Certificate, Automation Anywhere Certified Advanced RPA Professional, Data Engineering 1 from Purdue University , Diploma of Completion RPA Developer Foundation Training in Uipath, Introduction to Data Science 2 from Purdue University , Introduction to Data Science from Purdue University , Uipath orchestrator Training",Bengaluru,Karnataka,India,ml_engineer
NLP Data Scientist ,ConcertAI,1.9,"Natural Language Processing (NLP), Python (Programming Language), Mathematics, Machine Learning Algorithms, PyTorch, Data Science, Computer Vision, Deep Learning, Engineering, Programming, C (Programming Language), Machine Learning, Flutter, Data Structures",Master of Technology - MTech,International Institute of Information Technology Bangalore,"Python Data Structures, Programming for Everybody (Getting Started with Python)",Bengaluru,Karnataka,India,ml_engineer
Sr Machine Learning Engineer,PayPal,6.5,"Model deployment, Feature Engineering, Real Time System Design, MLops , Consumer Lending, Customer analytics, Credit Risk Management, ML System Design, Natural Language Processing (NLP), Amazon Web Services (AWS), Credit Risk Modeling, MLOps, Machine Learning, Problem Solving, Analytics, Data Mining, statistics, Data Analysis, Operations Management, Data Structures, Algorithms, Data Science, Statistical Modeling, R, Python, SQL, CATIA, Java, Microsoft Excel, Leadership, Stochastic Processes, Data Analytics, Statistics, Image Processing, Machine Learning Algorithms, Python (Programming Language), Data Visualization, Storytelling, Multivariate Statistics, Cluster Analysis, Unsupervised Learning, Convolutional Neural Networks (CNN), Recurrent Neural Networks (RNN), Long Short-term Memory (LSTM), Extract, Transform, Load (ETL), Google Cloud Platform (GCP), Google BigQuery, Apache Beam, PySpark",M.Tech,"Indian Institute of Technology, Kanpur",,Bengaluru,Karnataka,India,ml_engineer
Associate Consultant,KPMG Global Services,11.8,"Extract, Transform, Load (ETL), Amazon Web Services (AWS), SQL, Data Analysis, Analytical Skills, Python (Programming Language), Computer-Aided Design (CAD), Project Management, Project Planning, Team Leadership, Autodesk Fusion 360, Mechanical Engineering, Manufacturing, CAD/CAM, Automotive, Design, SOLIDWORKS, ANSYS, AutoCAD, 3D Computer Aided Design (3D CAD), MATLAB, Microsoft PowerPoint, Microsoft Office, Public Speaking, Teamwork, English, DFMA, Abaqus, COMSOL",Master of Technology - MTech,Motilal Nehru National Institute Of Technology,"Alteryx Designer Core Certification, AWS Certified Cloud Practitioner, Microsoft Certified: Azure Data Fundamentals,  Autodesk CAD/CAM/CAE for Mechanical Engineering Specialization, CAM and Design Manufacturing for Mechanical Engineers with Autodesk Fusion 360, Python Data Structures, Simulation Analysis for Mechanical Engineers with Autodesk Fusion 360, SnowPro Core Certification, edX Verified Certificate for A Hands-on Introduction to Engineering Simulations",Bengaluru,Karnataka,India,ml_engineer
CRM Analyst Intern,FreshToHome,6.8,"Statistics, Data Visualization, Business Intelligence (BI), Data Analytics, Business Analytics, Analytical Skills, Data Modeling, Data Architecture, Programming, Data Structures, Algorithms, Net Promoter Score, Python (Programming Language), Data Analysis, Data Science, SQL, Databases, Microsoft Power BI, Tableau, Machine Learning, Artificial Intelligence (AI), Data Engineering, Adobe Photoshop, Engineering",Btech,"MES College of Engineering, Kuttippuram","Python for Data Science, PwC Switzerland - Power BI Job Simulation, Big Data Foundations - Level 1",Bengaluru,Karnataka,India,ml_engineer
Machine Learning Engineer,MPS Limited,3.0,"AWS Command Line Interface (CLI), boto3, Amazon ECS, HTML, XHTML, XML, Image Processing, NLTK, PyTorch, FastAPI, Cluster Analysis, NoSQL, Docker, PostgreSQL, Seaborn, Scikit-Learn, MongoDB, Linux, Git, Computer Vision, Extract, Transform, Load (ETL), Data Science, Web Scraping, Plotly, Linear Algebra, Combinatorics, Calculus, Prompt Engineering, Natural Language Generation, Analysis Reports, Data Modeling, Databases, Visualization, Exploratory Data Analysis, SQLAlchemy, Microsoft Power BI, Machine Learning, Natural Language Processing (NLP), Data Visualization, Presentations, Communication, Analytical Skills, SQL, Tableau, Problem Solving, Data Analysis, Python (Programming Language)",Master's degree,Loyola College,,,Tamil Nadu,India,ml_engineer
Machine Learning Engineer,Tiger Analytics,5.1,"PySpark, Big Data, Data Engineering, SQL, Extract, Transform, Load (ETL), Microsoft Azure, Apache Spark, Azure Data Lake, Azure Data Factory, Technical Documentation, Data Architecture, Business Requirements, Data Manipulation, Presentations, Strategic Thinking, Optimization, Problem Solving, Communication, Azure Databricks, Data Lakes, C (Programming Language), Database Management System (DBMS), Data Structures, Machine Learning, Python (Programming Language), Pandas (Software), Scikit-Learn, NumPy, TensorFlow, Keras, Data Analysis, Research, Data Analytics, Artificial Intelligence (AI), Deep Learning, Time Series Analysis, Sequence Analysis, Convolutional Neural Networks (CNN), Recurrent Neural Networks (RNN), Long Short-term Memory (LSTM), Algorithms, Flask",Bachelor of Technology - BTech,Sikkim Manipal Institute of Technology,"Databricks Certified Data Engineer Associate, Academy Accreditation - Generative AI Fundamentals, Databricks Certified Machine Learning Professional, Academy Accreditation - Databricks Lakehouse Fundamentals",Bengaluru,Karnataka,India,ml_engineer
Senior Consultant,EXL,7.3,"Microsoft Azure, Probabilistic Graphical Models, Graph Neural Networks, Generative AI, Nvidia, Analytics Engineering, Graph Neural Network, Analytics Engineer, Team Leadership, Object-Oriented Programming (OOP), Large Language Models (LLM), MLOps, Natural Language Processing (NLP), Data Analytics, Python (Programming Language), Data Engineering, Machine Learning, Data Science, Data Analysis, Deep Learning, Statistics, TensorFlow, Data Visualization, Jenkins, Git, Java, Django, Flask, Heroku, Amazon Web Services (AWS), Node.js, SQL, NumPy, pandas, Scikit-Learn, SciPy, Seaborn, Matplotlib, spaCy, NLTK",Master of Technology - MTech,BITS Pilani Work Integrated Learning Programmes,"Microsoft Applied Skills: Create an intelligent document processing solution with Azure AI Document Intelligence, Microsoft Certified: Azure AI Engineer Associate, NVIDIA-Certified Associate: Generative AI LLMs, Practical Multi AI Agents and Advanced Use Cases with crewAI, Introduction to PySpark, Data Science: Natural Language Processing (NLP), Master Jenkins CI For DevOps and Developers, Deep Learning Specialization by DeepLearning.AI, The Data Scientist’s Toolbox, Version Control with Git",Bengaluru,Karnataka,India,ml_engineer
Ground Staff,Bangalore International Airport Ltd,1.7,"Microsoft Office, Database Auditing, SQL Database Administration, Safety Monitoring, Safety Compliance, MySQL, Pandas (Software), Data Visualization, Machine Learning Algorithms, Stock Replenishment, Python (Programming Language), Data Science, Customer Retention, Data Modeling, Jupyter, Modeling, Creativity and Innovation, Admitted to Practice, Statistical Inference, Hypothesis Testing, Data-driven Decision Making, Statistical Analysis, Airport Security, Matplotlib, Retention Strategies, Seaborn, Predictive Modeling, Artificial Intelligence (AI), Tableau, SQL, Statistics, Data Manipulation, Statistical Data Analysis, Machine Learning, Business, Leadership, Analytical Skills, Management, Communication, Business Analysis, Data Analysis",Bachelor of Business Administration,Jain (Deemed-to-be University),,Bengaluru,Karnataka,India,ml_engineer
Python Developer,OctaNet Services Pvt Ltd.,1.2,"Analytical Skills, Statistics, Database concepts, Data Visualization, Natural Language Processing (NLP), Microsoft Power BI, Python (Programming Language), Business Management, Business Analysis, Artificial Intelligence (AI), Data Science, Business Development, Problem Solving, Project Management, Machine Learning, Business Intelligence (BI), Data Analysis, Engineering",Bachelor of Technology - BTech,Dhaanish Ahmed College of Engineering,"Certificate of Participation in Challenge 25 of Weekly Coding Challenge, Certificate of Participation in Challenge 27 of Weekly Coding Challenge, Certificate of Participation in Concept Note Submission of Road Safety Hackathon, Certificate of Participation in K! HACKS 2.0 - Idea Submission of K! Hacks 2.0, Analyzing and Visualizing Data with Microsoft Power BI, Cisco Certified data analyst , Accenture North America - Data Analytics and Visualization Job Simulation, Preparing Data for Analysis with Microsoft Excel",Chennai,Tamil Nadu,India,ml_engineer
Data Scientist,Deloitte,7.0,"python, speech processing, Generative Adversarial Networks (GANs), Predictive Analytics, Data Cleaning, Data Analytics, AI Solutions, Convolutional Neural Networks (CNN), Optimising, Pattern Recognition, Model Development, Git, Interpersonal Communication, Knowledge Sharing, Data Preparation, Product Requirements, Data Collection, Mathematics, NumPy, Data Presentation, Databases, Technical Specs, Data Governance, REST APIs, Analytical Solutions, Optimization Techniques, Optimization, Documentation, Presentations, Datasets, Apache Spark, Statistics, Analytics, Problem Solving, Feature Extraction, Unsupervised Learning, Communication, Data Processing, Attention to Detail, Deep Learning, Computer Science, Speech Recognition, Computer Vision, Artificial Intelligence (AI), Programming, Image Processing, Machine Learning, Embedded Systems, Python (Programming Language), PyTorch, Teamwork, Scikit-Learn",Bachelor of Engineering,St. Joseph Engineering College Mangaluru,"CutShort Certified Machine Learning (ML) - Basic, Python (Basic) Certificate, Machine Learning",Bengaluru,Karnataka,India,ml_engineer
Data Scientist,InnoWave,3.1,"Chatbot Development, Chatbot Responses, Chatbot Design, Knowledge Graphs, Cloud Storage, Cloud function , Google Cloud Platform (GCP), AgentSpace, Agent development kit(ADK), GitHub, Large Language Models (LLM), Amazon Web Services (AWS), Statistical Data Analysis, Statistics, Data Collection, Data Cleaning, Process Efficiency, Extract, Transform, Load (ETL), Knowledge Sharing, Attention to Detail, VBA Excel, Visual Basic for Applications (VBA), Data Engineering, NumPy, Microsoft Power Query, Microsoft Excel, Microsoft Power BI, Data Modeling, Storytelling, Interpersonal Communication, Data Quality, Dashboards, Statistical Concepts, Identifying Trends, Databases, Visualization, Business Analytics, Identifying New Opportunities, Big Data Analytics, Computer Vision, Critical Thinking, Natural Language Processing (NLP), Analytics, Mathematical Modeling, Apache Spark, Statistical Modeling, TensorFlow, Microsoft Office, Hadoop, Deep Learning, Artificial Intelligence (AI), Data Science, Data Visualization, Big Data, SQL, Tableau, Machine Learning, Pycharm, Project Management, Programmes, Presentations, Analytical Skills, Leadership, Problem Solving, Data Analytics, Learning, English, Communication, Data Analysis, Python (Programming Language), Pandas (Software), Anaconda, Seaborn",Master's degree,University of Calcutta,"Data Science and AI Certificate for Managers and Leaders, Deep Learning Fundamentals, Machine Learning with Python, Python 101 for Data Science, Sectoral Analytics Fundamental - Finance, Sectoral Analytics Fundamentals - HR, Sectoral Analytics Fundamentals -Marketing, Excel: Mother of Business Intelligence, Certificate of completion - Intro to ChatGPT and Generative AI",Bengaluru,Karnataka,India,ml_engineer
"Senior Data Scientist, Architect",Omdena,22.5,"AWS SageMaker, AWS Lambda, Cloud Computing, Artificial Intelligence (AI), Machine Learning, Deep Learning, Computer Vision, Android Development, iOS Development, Web Development, Algorithms, AngularJS, JavaScript, Amazon Web Services (AWS), Node.js, MySQL, Python (Programming Language), C, C++, Java, jQuery, RESTful WebServices, JavaScriptMVC, Natural Language Processing (NLP), Chatbot Development, Scikit-Learn, Webrtc, Apache Spark, Google Cloud Platform (GCP), Linux, SQL, PostgreSQL, Bigtable",Post Graduate Diploma in Machine Learning and Artificial Intelligence,International Institute of Information Technology Bangalore,,Bengaluru,Karnataka,India,ml_engineer
Associate Data Analyst,Genpact,2.7,"PyTorch, Greenplum, SQL, Snowflake, Azure SQL, XML Schema Design, Data Mapping, Optimization, Agile Methodologies, Confluence, Jira, Amazon S3, Microsoft Azure, Talend, Informatica, PySpark, PL/SQL, Troubleshooting, Object Tracking, Object Detection, Ad Hoc Reporting, MLflow, Presentations, Business Process, BERT (Language Model), Optical Character Recognition (OCR), Large Language Models (LLM), OpenAI API, Chatbot Development, Data Science, Deep Learning, Neural Networks, Natural Language Processing (NLP), Artificial Intelligence (AI), Project Management, General Administration, Statistical Analysis, Data Models, Communication, Databases, Data Integrity, Debugging, Timelines, Concept Generation, Critical Thinking, Data Warehousing, Data Profiling, Identifying Trends, Dashboards, Business Insights, Analytical Skills, Organization Skills, Visual Thinking, Visualization, SAS (Software), Microsoft Power BI, Data Analytics, Big Data Analytics, Scala, Machine Learning, Data Extraction, Data Scraping, Data Visualization, Data Cleaning, Scikit-Learn, Python (Programming Language), R (Programming Language), Git, Analytics, Data Analysis, Data Mining, Big Data, Statistical Data Analysis, Data Modeling, Engineering, Web Applications, Time Management, English, Digital Marketing, Marketing Strategy, Networking, Computer Ethics, Generative AI",Bachelor of Technology - BTech,APJ Abdul Kalam Technological University,"Certified Data Scientist, Career Essentials in Generative AI by Microsoft and LinkedIn, Big Data Foundations - Level 1, British Airways Internship, Data Science Tools, JPMorgan Chase & Co Internship, Scala Programming, Data science Foundation, Data Analyst, Data Wrangling and Visualization using R",Bengaluru,Karnataka,India,ml_engineer
Kaggle Notebooks Expert,Kaggle,3.6,"Data science , deep learning , Generative AI, Artificial Intelligence (AI), Neural Networks, ANN, Convolutional Neural Networks (CNN), Keras, TensorFlow, Recurrent Neural Networks (RNN), Computer Vision, OpenCV, Deep Learning, Python (Programming Language), Machine Learning, Data Analysis, Data Science, Natural Language Processing (NLP), SQL",Master of Technology - MTech,Vellore Institute of Technology,"Computer Vision with OpenCV and Deep Learning, Complete Tensorflow 2 and Keras Deep Learning Bootcamp, The Data Science Course 2022: Complete Data Science Bootcamp, 2021 Complete Python Bootcamp From Zero to Hero in Python",Bengaluru,Karnataka,India,ml_engineer
AI and ML Intern,Zephyr Technologies and Solutions PVT LTD,0.4,"Salesforce , Microsoft Word, SQL, HTML, MySQL, C (Programming Language), Python (Programming Language)",Bachelor of Engineering - BE,"SDM INSTITUTE OF TECHNOLOGY (SDMIT), UJIRE",,Bengaluru,Karnataka,India,ml_engineer
Software Engineer ML,Myntra,3.1,"Azure Databricks, Apache Spark, C++, Python (Programming Language), Data Structures and Algorithms, C (Programming Language), Machine Learning, Network Technologies, SNMP, PyTorch, TensorFlow, SQL, OpenCV, MATLAB, Node.js, Verilog, Amazon Web Services (AWS), pytest, Java",Bachelor of Technology - BTech,"Indian Institute of Technology, Guwahati",,Bengaluru,Karnataka,India,ml_engineer
Staff Machine Learning Engineer,ServiceNow,8.7,"Artificial Intelligence (AI), Prompt Engineering, Large Language Models (LLM), Applied Machine Learning, Project Management, Software Development, Python, Java, C, Machine Learning, JavaScript, PHP, MySQL, WordPress, Linux, MongoDB, Public Speaking, Webrtc, Deep Learning, Convolutional Neural Networks (CNN), Data Structures, Algorithms, Design Patterns, Microservices, Python (Programming Language)",Engineer's Degree,National Institute of Technology Silchar,"Convolutional Neural Networks, Improving Deep Neural Networks: Hyperparameter tuning, Regularization and Optimization, Structuring Machine Learning Projects, Neural Networks and Deep Learning, MongoDB for Developers, JAVA, C",Hyderābād,Telangana,India,ml_engineer
Senior Lead AI/ML Engineer,Siemens Advanta,18.1,"Reinforcement Learning, FastAPI, Python (Programming Language), Generative AI, Flask, Object Detection, Statistics, A/B Testing, Problem Solving, Data Modeling, NoSQL, Time Series Forecasting, Cloud Computing, Computer Vision, Applied Machine Learning, Data Analytics, Business Requirements, Data Standards, Communication, Seaborn, Apache Spark, Clustering, Azure Data Factory, Deep Learning, Artificial Intelligence (AI), Artificial Neural Networks, Convolutional Neural Networks (CNN), Recurrent Neural Networks (RNN), Big Data Analytics, Stream Processing, Microsoft Power BI, REST APIs, Forecasting, Prescriptive Analytics, Supervised Learning, Unsupervised Learning, Data Visualization, Data Analysis, Data Science, Microsoft Azure, Azure Databricks, Machine Learning, Data Management, Banking, Product Quality, SAS Programming, Statistical Modeling, PySpark, Python, SQL, Pandas (Software), Team Management, Scikit-Learn, Matplotlib, NumPy, Logistic Regression, Linear Regression, Regression Models, Bayesian networks, Natural Language Processing (NLP), Neural Networks, Decision Trees, ANOVA, ARIMA, Predictive Modeling, Predictive Analytics",Master of Technology - MTech,BITS Pilani Work Integrated Learning Programmes,,Bengaluru,Karnataka,India,ml_engineer
SDE-ML,TELUS Digital AI Data Solutions,3.7,"Responsible AI, Medical Imaging, Datasets, Information Extraction, Text Classification, GPT-4, Information Retrieval, C++, Computer Science, Custom GPTs, BERT (Language Model), REST APIs, Chatbots, Healthcare Analytics, Google Gemini, Vertex, YAML, Git, Object-Oriented Programming (OOP), Application Programming Interfaces (API), Cloud Infrastructure, Data Analytics, Good Clinical Practice (GCP), Machine Learning Algorithms, Pattern Recognition, Object Detection, Image Processing, Data Pipelines, Model Compression, Retrieval-Augmented Generation (RAG), Microsoft Azure, Generative AI Studio, Amazon Web Services (AWS), Test Planning, Integration Testing, Unit Testing, Recommender Systems, Skill Development, Machine Tools, MLOps, Data Science, Transformers, Version Control, Neuro-Linguistic Programming (NLP), Coding Standards, Communication, Thinking Skills, Exploratory Data Analysis, Technical Writing, Transformer Models, openFDA, Langgraph, LangChain, NumPy, Artificial Intelligence (AI), Data Visualization, SQL, Deep Learning, Databases, Large Language Models (LLM), NoSQL, Prompt Engineering, Model Building, Data Preparation, Model Training, Generative AI, Pandas (Software), Problem Solving, Convolutional Neural Networks (CNN), Google Cloud Platform (GCP), Natural Language Processing (NLP), Computer Vision, TensorFlow, PyTorch, Software Documentation, EDA, Python (Programming Language), Machine Learning, Web Development, Front-end Development, Java, MySQL, HTML5, Cascading Style Sheets (CSS), JavaScript",Bachelor of Technology - BTech,University Visvesvaraya college of engineering Bangalore ,Associate Cloud Engineer,Bengaluru,Karnataka,India,ml_engineer
Associate (SDE II),Goldman Sachs,5.9,"Defining Requirements, Computer Science, Agile Environment, REST APIs, Design Patterns, Application Development, Git, Communication, Back-End Web Development, Application Programming Interfaces (API), Analytical Skills, Spring Framework, Software Development, Apache Kafka, MongoDB, Full-Stack Development, Microservices, C++, Object-Oriented Programming (OOP), Deep Learning, Machine Learning, Data Structures, Algorithms, Amazon Web Services (AWS), C (Programming Language), Java, Python, Operating Systems, C, Problem Solving, Neural Networks, Spring Boot",Bachelor of Engineering (Hons.),"Birla Institute of Technology and Science, Pilani",Deep Learning Specialization,Bengaluru,Karnataka,India,ml_engineer
AL/ML Computational Science Specialist,Accenture in India,9.3,"Artificial Intelligence (AI), Machine Learning, Pandas (Software), Computer Vision, Parallel Programming, Deep Learning, Python (Programming Language), Robot Operating System (ROS), System Architect, TensorRT, Research, Leadership, Public Speaking, Keras, TensorFlow, PyTorch, OpenCV",Masters in Control Systems,Manipal Institute of Technology,"Salsify GDSN Essentials Proficiency, Generative AI APIs for Practical Applications: An Introduction, Introduction to Generative AI, Introduction to Large Language Models, Improving Deep Neural Networks: Hyperparameter Tuning, Regularization and Optimization, Neural Networks and Deep Learning, Structuring Machine Learning Projects, Deep Learning with Pytorch, Pytorch Essential Training: Deep Learning , Transfer Learning for Images Using Pytorch: Essential Training, Advanced Python, Python Parallel Programming Solutions, Efficient Python Production Workflows, Faster Python Code, Managing Python Projects, Unit Testing and Test Driven Development in Python, Deep Learning Certificate Program",Bengaluru,Karnataka,India,ml_engineer
