current_position,current_company,years_of_experience,total_skills,education_degree,education_institution,certifications,city,state,country,profile_type
AIML Engineer ,WebMobi 360 | B2B AIML Solutions,0.5,"Deep Learning, Business Intelligence (BI), Data Analysis, Data Mining, Analytics, Visualization, R (Programming Language), Problem Solving, Web Applications, Generative AI, Neuro-Linguistic Programming (NLP), Large Language Models (LLM), Use Cases, Algorithms, Natural Language Processing (NLP), Speech Recognition, TTS, Data Science, Machine Learning, Data Analytics, Microsoft Power BI, Data Visualization, Power Bi, SQL, Artificial Intelligence (AI), Python (Programming Language), Trend Analysis, Analytical Skills, Sales Analysis, Content Automation, Loan Auditing, Data-driven Decision Making, Intercollegiate Athletics, Food ordering, College Applications, Statistical Data Analysis, Collaborative Learning, Recommender Systems, Predictive Modeling, Dashboard Metrics, Signal Processing, Data Modeling, Microsoft Excel, Communication, Collaboration",Msc,Alliance University,"Accenture North America - Data Analytics and Visualization Job Simulation, Process Data from Dirty to Clean, Ask Questions to Make Data-Driven Decisions, Prepare Data for Exploration, SQL for Data Science, Exploratory Data Analysis for Machine Learning, Object-Oriented Data Structures in C++, Supervised Machine Learning: Regression",,,India,ml_engineer
Software Engineer,Texas Instruments,7.2,"GitHub, Research and Development (R&D), Startups, Distributed Training, Optimization, Transformers, Fine Tuning, Amazon Web Services (AWS), CUDA, PyTorch, Applied Research, Pattern Recognition, Data Science, Computer Science, Computer Vision, Embedded Software, Deep Learning, Learning, Datasets, Convolutional Neural Networks (CNN), Applied Machine Learning, Software, Statistics, Neural Networks, English, Statistical Analysis, Data Modeling, Bash, Knowledge Acquisition, Oral Communication, Scripting, NumPy, Linux, Communication, Non-Functional Requirements, System Performance, System Architecture, Maintainability, Generative AI, Artifical intelligence, Machine Learning Algorithms, Model Training, pandas, TensorFlow, Keras, Amazon EC2, Data handling, Jupyter notebook , Ubuntu, Artificial Intelligence (AI), Machine Learning, MySQL, Design Patterns, Databases, Programming Languages, LTE, Python (Programming Language), JSON, C++, Programming, Marketing, C (Programming Language), Data Structure and Algorithms, Object-Oriented Programming (OOP), Node.js, JavaScript",Bachelor of Technology - BTech,Motilal Nehru National Institute Of Technology,"SAP Gen-AI, IP Awareness and Training Program, Flipkart Grid 4.0, Innovate India Coding Championship, SQL Certificate, Kick Start 2021, Certificate of Co-Ordination, Renaissance'21, Problem Solving intermediate, Problem Solving, Gen-AI, JumpStart Participation, Uber HackTag 2.0",Bengaluru,Karnataka,India,ml_engineer
Senior Applied AI Scientist,Best Buy,7.9,"Git, A/B Testing, MLflow, MERN Stack, Large Language Models (LLM), Airflow, Teamwork, System Implementations, Skill Development, Knowledge Acquisition, Pattern Recognition, DevOps, Recommender Systems, Shell Scripting, Flask, SQL, Application Programming Interfaces (API), MLOps, Data Science, Cassandra, Solr, Natural Language Processing (NLP), MEAN, backend, Machine Learning, Data Mining, Data Structures, Algorithms, Deep Learning, computer vision, deep learning, machine learning, python, TensorFlow, Amazon Web Services (AWS), Keras, Google Cloud Platform (GCP), JavaScript, docker, GitHub, Heroku, Linux, Django",Bachelor's degree,RGUKT Basar,"Ai Internet Health Hackathon, Azure Ninja CAT @ 'Week of AI', Improving Deep Neural Networks(Coursera Deeplearning Specialization course), Structuring Machine Learning Projects-Coursera, Worldwide Artificial Intelligence Hackathon , Neural Networks and Deep Learning, ChallengeACI (National wide AI hackathon), Data Structures and Algorithms Using Python, Introduction To Modern Application Development",Hyderābād,Telangana,India,ml_engineer
Senior Data Scientist,Freshworks,5.6,"PyTorch, BERT (Language Model), Retrieval-Augmented Generation (RAG), Vector Databases, Generative AI, RAG, AstraDB, Large Language Models (LLM), Docker, Kubeflow, Amazon Web Services (AWS), MLOps, FastAPI, MongoDB, Cassandra, Langchain, Kubernetes, Amazon Elastic Container Registry (ECR), Amazon EC2, Data Analysis, Python, Machine Learning, Deep Learning, Python (Programming Language), TensorFlow, Natural Language Processing (NLP), Gradient Boosting, Machine Learning Algorithms, SQL",Integrated B.Tech & M.Tech,Indian Institute of Technology Kharagpur,"Improving Deep Neural Networks: Hyperparameter tuning, Regularization and Optimization, Neural Networks and Deep Learning, Bloomberg Market Concepts",Hyderābād,Telangana,India,ml_engineer
Machine Learning Engineer,NoBroker.com,1.9,"Tableau, Microsoft Azure, Fine Tuning, Computer Vision, Machine Learning Algorithms, Pandas (Software), Natural Language Processing (NLP), MongoDB, Statistical Modeling, LangChain, Artificial Intelligence (AI), Large Language Models (LLM), Retrieval-Augmented Generation (RAG), Parsing, Docker, Apache Kafka, Neuro-Linguistic Programming (NLP), FastAPI, Recommender Systems, Machine Tools, Thinking Skills, Statistical Learning, Data Pipelines, MLOps, Google Cloud Platform (GCP), Microsoft Power Query, Data Modeling, Microsoft Power BI, Mathematics, Statistics, Data Science, TensorFlow, Image Processing, Deep Neural Networks (DNN), PyTorch, HTML, SQL, Data Cleaning, Communication, Generative AI, Problem Solving, Visualization, Statistical Analysis, Data Analytics, Neural Networks, Deep Learning, Unsupervised Learning, Reinforcement Learning, Data Analysis, Data Visualization, Analytical Skills, Machine Learning, Python (Programming Language), R (Programming Language), Data Structures, NumPy, Scikit-Learn, Matplotlib, Seaborn, Plotly, ggplot",Master of Science - MS,"Christ University, Bangalore","Machine Learning Specialization, Unsupervised Learning, Recommenders, Reinforcement Learning, Advanced Learning Algorithms, Supervised Machine Learning: Regression and Classification, data science 101, Data Science with python, Data Analysis with Python, Programming for Everybody (Getting Started with Python), Using Python to Access Web Data, Capstone: Retrieving, Processing, and Visualizing Data with Python, Python Data Structures",Bengaluru,Karnataka,India,ml_engineer
Machine Learning Engineer,Morgan Stanley,4.2,"Docker, Go (Programming Language), React.js, Snowflake, FastAPI, docker, gRPC, Microsoft SQL Server, Search Based Analytics, DevOps, Back-End Web Development, Systems Design, Architectural Design, Database Administration, Kanban, Data Engineering, Amazon Web Services (AWS), C (Programming Language), C++, Python, Algorithms, Data Structures, Machine Learning, Object-Oriented Programming (OOP), Web Development, JavaScript, Blockchain, Django, Solidity, Git, MySQL, Firebase, Database Management System (DBMS), GNU Octave, Deep Learning, PyTorch, Python (Programming Language), Applied Machine Learning, Natural Language Processing (NLP), Computer Vision, Generative Models, SQL, Data Science, TensorFlow, Linux, fast.ai, Google Trax, Flutter",Master of Science,PSG College of Technology,"Build Basic Generative Adversarial Networks (GANs), AI for Medical Diagnosis, Natural Language Processing with Sequence Models,  Facial Expression Recognition with Keras, Image Super Resolution Using Autoencoders in Keras, Natural Language Processing with Probabilistic Models, Understanding Deepfakes with Keras,  Sentiment Analysis with Deep Learning using BERT, Convolutional Neural Networks in TensorFlow, Deep Learning Specialization, DeepLearning.AI TensorFlow Developer Specialization, Improving Deep Neural Networks: Hyperparameter tuning, Regularization and Optimization, Natural Language Processing in TensorFlow, Natural Language Processing with Classification and Vector Spaces, Sequences, Time Series and Prediction, Structuring Machine Learning Projects,  Perform Real-Time Object Detection with YOLOv3, Convolutional Neural Networks, Image Compression and Generation using Variational Autoencoders in Python, Introduction to TensorFlow for Artificial Intelligence, Machine Learning, and Deep Learning, Neural Networks and Deep Learning, Sequence Models",Bengaluru,Karnataka,India,ml_engineer
Lead Consultant - AI/ML Engineer ,Genpact,4.9,"LangChain, Prompt Engineering, AWS SageMaker, Large Language Models (LLM), Streamlit, GenAI, Azure DevOps, Google Cloud Platform (GCP), Machine Learning, Python (Programming Language), Microsoft SQL Server, Data Analysis, Natural Language Processing (NLP), Data Visualization, Tableau, Microsoft Excel, SQL, Microsoft Power BI, Flask, Soft Skills, Problem Solving, Vertica Database, Data Science, Statistics, Predictive Analytics, Docker, Shapash",Master of Science - MS,"School of Data Science And Forecasting ,DAVV","Data Analysis with Python, Applied Data Analytics
, ANZ Virtual Experience
, Machine Learning, What Is Data Science?, Supervised Learning with Scikit-Learn, Python Programming: A concise Introduction,  Python for Data Science and AI",Bengaluru,Karnataka,India,ml_engineer
Lead ML Engineer,Delta Technology Hub,9.9,"GitHub, Solution Architecture, Team Leadership, Continuous Integration and Continuous Delivery (CI/CD), Azure Kubernetes Service (AKS), Sprint Planning, Agile Methodologies, Object-Oriented Programming (OOP), MLflow, Docker Products, PySpark, Azure Databricks, Azure Data Factory, Agile Project Management, MLOps, Artificial Intelligence (AI), Deep Learning, Business Analytics, Business Intelligence (BI), Machine Learning, Data Visualization, Cloud Computing, Computer Vision, Data Science, Image Processing, Data Analysis, Python (Programming Language), TensorFlow, MongoDB, Pandas (Software), Keras, QlikView, Django, Microsoft SQL Server, PyTorch, FastAPI, BERT, Pytorch, Public Speaking, English, Scikit-Learn, Qlik Sense, Exploratory Data Analysis, OpenCV, Optical Character Recognition (OCR), Convolutional Neural Networks (CNN), Neural Networks, Natural Language Processing (NLP), Microsoft Azure Machine Learning, Azure DevOps",Bachelor of Technology - BTech,Maulana Azad National Institute of Technology,"Azure Databricks engineer, Deep Reinforcement Learning , Microsoft Certified Azure Data Scientist Associate",Bengaluru,Karnataka,India,ml_engineer
Catalyst Engineer,Cisco,1.7,"CCNA, System Performance, Data Manipulation, Pattern Recognition, Data Science, Pandas (Software), Analytical Skills, Generative Adversarial Networks (GANs), Communication, TensorFlow, Generative AI, Artificial Intelligence (AI), Visual Studio, Critical Thinking, JavaScript, Java, Figma (Software), Problem Solving, Python (Programming Language), Compilers, C++, Waste Water Treatment Plants, Modeling, Aquaculture, Data Structures, Matplotlib, Thinking Skills, Continuing Professional Development, Information Research, Computer Engineering, Java Certified Programmer, BOLT, NLTK, FastAPI, Technology Management, Deep Learning, Bootstrap (Framework), Web Development, Cloud Computing, Natural Language Processing (NLP), Computer Science Education, Smoke Detectors, NumPy, Natural Language, Machine Learning Algorithms, Intermediates, Leadership, Model Training, Wireless Sensor Networks, Twilio, Cloud Development, Windows, Postman API, Developer Tools, MATLAB, Technical Engineering, Innovation Consulting, Technological Innovation, Computer Programming, Cascading Style Sheets (CSS), Google Cloud Platform (GCP), Linux, Image Processing, Flask, Programming Language Theory, React.js, Soft Skills, Machine Learning, Large Language Models (LLM), Research and Development (R&D), Study Coordination, Speech Processing, Software Development",Bachelor of Technology - BTech,HITAM (Hyderabad Institute of Technology and Management),"Data Analysis with Python, Implementing and Administering Cisco Solutions (CCNA) 2.2",Bengaluru,Karnataka,India,ml_engineer
AI ML Engineer,DATASPARK AI SOLUTIONS,8.5,"Statistical Data Analysis, Data Quality, Deep Learning, Python (Programming Language), Billing Process, Electronic Medical Record (EMR), Medical Coding, Healthcare applications, EPIC Resolute Professional Billing, Data Research, Microsoft Excel, Microsoft Word, Dashboards, Health Insurance, Tableau, SQL, Machine Learning, Data Analysis, Engineering",M.Tech,SJCE  Mysore,"Dataiku Advanced Designer, Dataiku Developer, Dataiku ML Practitioner, Dataiku MLOps Practitioner",Bengaluru,Karnataka,India,ml_engineer
Sr. Applied ML Engineer,Mindtickle,7.1,"Artificial Intelligence (AI), Decision Trees, Transformers, LangChain, LlamaIndex, LLaMA, Langgraph, CrewAI, Agents, Predictive Modeling, MCP, Large Language Model Operations (LLMOps), Data Warehousing, Amazon Web Services (AWS), Microsoft Azure, Go (Programming Language), MLOps, Retrieval-Augmented Generation (RAG), Elasticsearch, Vector Databases, Research and Development (R&D), ASR, TTS, Agentic Workflows, Large Language Models (LLM), Generative AI, Machine Learning, Deep Learning, Natural Language Processing (NLP), Speech Recognition, Python, Data Analysis, Data Modeling, JavaServer Pages (JSP), C++, HTML, Cascading Style Sheets (CSS), JavaScript, jQuery, TensorFlow, keras, Python (Programming Language), C (Programming Language), Linux, Neural Networks, Natural Language Processing, full stack development, Web Scraping, Convolutional Neural Networks (CNN)",Bachelor of Technology,Indian Institute Of Information Technology Kalyani,"Artificial Intelligence Foundations: Thinking Machines, Building Deep Learning Applications with Keras 2.0, Building a Recommendation System with Python Machine Learning & AI, Building a Recommendation System with Python Machine Learning & AI, Deep Learning Specialization, Deep Learning: Face Recognition, Sequence Models, Structuring Machine Learning Projects, Convolutional Neural Networks, Improving Deep Neural Networks: Hyperparameter tuning, Regularization and Optimization, Neural Networks and Deep Learning",Bengaluru,Karnataka,India,ml_engineer
Software engineer 1,Tessolve,0.9,"FastAPI, Back-End Web Development, Data Structures, Teamwork, ChatGPT, Data Modeling, Analytics, Model Training, RDBMS, Easily Adaptable, Critical Thinking, Generative AI Tools, Prompt Engineering, Interpersonal Skills, Scikit-Learn, Machine Learning Algorithms, Microsoft Office, Microsoft Power BI, Object-Oriented Programming (OOP), Decision-Making, Data Manipulation, Data Extraction, Data Collection, Natural Language Processing (NLP), Reinforcement Learning, Data Science, MySQL, Extract, Transform, Load (ETL), AIML, Regression Models, Classification, Feature Engineering, English, Html(basics), Generative AI, Data Generation, Querying Databases, Data Augmenting, Relational Databases, Microsoft PowerPoint, Organization Skills, Seaborn, Matplotlib, Plotly, Team Management, Data Analysis, Predictive Modeling, Dashboards, Communication, Data Visualization, IBM Cognos Analytics, Spreadsheets, Data Cleaning, Data Wrangling, Analytical Skills, Problem Solving, Data Analytics, pandas, NumPy, Machine Learning, SQL, Artificial Intelligence (AI), Microsoft Excel, Python (Programming Language)",Bachelor of Engineering - BE,"Mangalore Institute of Technology and Engineering, Mangalore, India","Generative AI: Enhance your Data Analytics Career , Data Visualization with Python, Databases and SQL for Data Science with Python (with Honors), Data Analysis with Python, Data Visualization and Dashboards with Excel and Cognos, Excel Basics for Data Analysis, Introduction to Data Analytics, Python for Data Science, AI & Development",Bengaluru,Karnataka,India,ml_engineer
Machine Learning Engineer - IV,Groww,11.2,"MLflow, Performance Reviews, Team Motivation, MLOps, Supervisory Skills, Interpersonal Skills, Communication, Artificial Neural Networks, Artificial Intelligence, Machine Learning, Natural Language Processing, Python, Java, Linux, SQL, C, PHP, Software Development, Microsoft Word, NetBeans, C language, Data Structures, Programming, JavaScript, Microsoft Excel, Databases, CSS, Perl, Oracle SQL Developer, Microsoft PowerPoint, HTML, Data Science",Bachelor of Technology (B.Tech.),Greater Noida Institute of Technology,"AMCAT Certified Collections Specialist, AMCAT Certified Data Processing Specialist",Bengaluru,Karnataka,India,ml_engineer
Assistant ML Engineer - Trainee ,Capsitech,1.7,"LangChain, ARIMA, LLaMA, Natural Language Processing (NLP), Machine Learning , Retrieval-Augmented Generation (RAG), OCI services, Networking, Stable Diffusion, Research Projects, Research and Development (R&D), Gen AI, Django REST Framework, Databases, REST APIs, Cascading Style Sheets (CSS), Proficient in using OCI Generative AI Service, Build a Retrieval-Augmented Generation (RAG) based chatbot using OCI Generative AI Service, Large Language Models (LLM), Generative AI Tools, Deep learning , Research Skills, preprocessing, Image Segmentation, Object Detection, Version Control, GitHub, Git, Bash(Unix shell), Linux, GitFlow, Cloud Computing, chatbot, azure bot service, Flask, Deep Learning, Computer Vision, Artificial Intelligence (AI), C (Programming Language), Problem Solving, Core Java, Teamwork, Python (Programming Language), Machine Learning, Adobe Photoshop, CorelDRAW, Communication, Adobe Illustrator, Engineering, SQL",Bachelor of Technology - BTech,Parul University,"Microsoft Certified: Azure AI Fundamentals, Oracle Cloud Infrastructure 2024 Generative AI Certified Professional, Version Control - Meta, Parul Lets Hack ,  Supervised Machine Learning: Regression and Classification, Build a natural language processing solution with Azure AI Language, Build an Azure AI Vision solution, Create an intelligent document processing solution with Azure AI Document Intelligence",Bengaluru,Karnataka,India,ml_engineer
Data Scientist,Replicon,15.1,"Mortgage Industry, Model Development, TensorFlow, Data Science, Natural Language Processing (NLP), AWS Bedrock , Langgraph , LangChain, Communication, Feature Selection, Feature Engineering, Distributed Computing, Algorithms, Linear Algebra, Probability, Optimization, Predictive Analytics, Computer Science, Analytical Skills, Statistics, Statistical Data Analysis, Rasa NLU, Rasa Platform, Chatbot Development, Large Language Models (LLM), Amazon Web Services (AWS), MLflow, Machine Learning, Python, Elasticsearch, Data Visualization, R, Unix, Tableau, SQL, Hadoop, HBase, Hdfs, Microsoft Office, Microsoft Excel, Microsoft PowerPoint, HTML, Ansible, Git, Apache Flume, PySpark, R (Programming Language), Python (Programming Language), Teamwork, Apache Spark, Apache Kafka, Hive, Deep Learning",PGP in Big Data Analytics and Optimization,International School of Engineering (INSOFE),"Python and SQL, SQL, Machine Learning, Oracle SQL - Step by Step SQL, Python for Data Science and Machine Learning Bootcamp, Spark and Python for Big Data with Pyspark, Complete Python Bootcamp",,,India,ml_engineer
Machine Learning Engineer,PayPal,7.0,"REST APIs, SQL, AdvancedSQL, Apache Spark, Data Engineering, PySpark, Google BigQuery, Java, React.js, Generative AI, NestJS, NextJS, JavaScript, TypeScript, Team Building, Communication, Model Building, Progress Monitoring, Modeling, Analytics, Quantitative Analytics, Predictive Modeling, Data Modeling, Programming, Problem Solving, Management, Leadership, Team Management, Data Classification, Data Manipulation, Django, Algorithms, Data Structures, Data Science, MLOps, LaTeX, Artificial Intelligence (AI), C++, Microsoft Excel, Gaussian 09, GAMESS, Turbo C++, C, Python (Programming Language), Machine Learning",Industrial Mathematics and Scientific Computing (IMSC),"Indian Institute of Technology, Madras","Problem Solving (Basic), Python (Basic), Intermediate Machine Learning, Intro to Deep Learning, Introduction to Machine Learning",Chennai,Tamil Nadu,India,ml_engineer
Machine Learning Engineer,Prescience Decision Solutions,6.2,"Natural Language Processing (NLP), Whisper, Retrieval-Augmented Generation (RAG), Flask, Docker, Amazon Web Services (AWS), Agentic framework, Large Language Models (LLM), Vector Databases, API Management, Generative AI, Image Processing, Object Detection, Document Processing, Optical Character Recognition (OCR), Azure Data Factory, Machine Learning, Rasa, C++, C (Programming Language), Python (Programming Language), Digital Electronics, Arduino IDE, Football, Java, Data Structures",BTech - Bachelor of Technology,Lovely Professional University,"Generative AI Learning Program, C++ productivity hacks, C++ basic, Java Intermediate, Machine learning, Python programming, DSA self placed, Java Certification, Automation anywhere, Automation anywhere, Automation anywhere , Indian Robotics Community , udemy ",Bengaluru,Karnataka,India,ml_engineer
Machine Learning Engineer,iMerit Technology,1.6,"Large Language Models (LLM), Autoencoders, Generative Adversarial Networks (GANs), PyTorch, Artificial Intelligence (AI), Anomaly Detection, Time Series Analysis, Deep Learning, Microsoft Office, Microsoft Excel, Microsoft Word, Research, Machine Learning, Microsoft PowerPoint, HTML, Cascading Style Sheets (CSS), Python (Programming Language), TensorFlow, HTML Scripting",Dual Degree,"Indian Institute of Technology, Delhi","Convolutional Neural Networks, Introduction to TensorFlow for Artificial Intelligence, Machine Learning, and Deep Learning, Structuring Machine Learning Projects, Improving Deep Neural Networks: Hyperparameter tuning, Regularization and Optimization, Machine Learning, Neural Networks and Deep Learning, Multiple Linear Regression with scikit-learn",,,India,ml_engineer
Senior Machine Learning Engineer,Airbnb,14.7,"Large Language Models (LLM), Machine Learning, Data Science, Python, Project Management, Product Analytics, Figma (Software), Blockchain, Regulatory Compliance, TFlearn, TensorFlow, C++, C, C#, Microsoft SQL Server, HTML, HTML5, Cascading Style Sheets (CSS), CSS3, JavaScript, Hackathons, LInux, MongoDB, Node.js, Truffle, Deep Learning, Data Analysis, Natural Language Processing (NLP), PySpark, Python (Programming Language), Analytical Skills, Business Analytics, C (Programming Language), SQL",Post Graduate Diploma in Machine Learning & AI (PGDML&AI),International Institute of Information Technology Bangalore,"Advanced Topics on Deep Learning, Product Analytics 101, PGD in Machine Learning and Artificial Intelligence from IIIT Bangalore, PGD ML and AI May 2020 - Machine Learning 2 & Natural Language Processing, PGD ML and AI May 2020 - Statistics & Machine Learning 1, PGD ML and AI May 2020 - Prep Course Completion, Data@ANZ Program, KPMG@Data Analytics Consulting Program, PySpark Training, Data Science in Real Life, Executive Data Science Specialization, Introduction to Financial Markets, Managing Data Analysis, A Crash Course in Data Science, Building a Data Science Team, Introduction to Computer Programming, Business Analyst, Business Consultant, Channel Sales Professional, Collections Specialist, Corporate Communications Professional, Corporate Sales Manager, Creative Content Developer, Customer Service Specialist, Data Processing Specialist, English Comprehension, Operations Specialist - Life Sciences, Operations Specialist - Pharmaceuticals, Proficiency in English, Sales Professional - Life Sciences, Sales Professional - Pharmaceuticals, Software Development Trainee, Software Engineer - IT Services, Software Engineer - Product, Telesales Professional",Bengaluru,Karnataka,India,ml_engineer
Machine Learning Engineer,Apple,6.9,"Prompt Engineering, Artificial Intelligence (AI), Python (Programming Language), PyTorch, Amazon Web Services (AWS), CI/CD, Kubernetes, Large Language Models (LLM), MLOps, Machine Learning, Back-End Web Development, C++, HTML, Management, Deep Learning, Computer Vision, Statistics, Statistical Data Analysis, Bayesian statistics, Mathematical Statistics, Calculus, Multivariable Calculus, Vector Calculus, Probability, Probability Theory, Probabilistic Models, Natural Language Processing (NLP), Microsoft Excel",Bachelor of Technology - BTech,"Indian Institute of Technology, Roorkee",Unnat Bharat Abhiyan Team Member,Bengaluru,Karnataka,India,ml_engineer
Technical Lead Manager,Coinbase,14.8,"Digital Signal Processing, Machine Learning, Electrical Engineering, Matlab, C, C++, Python, Apache Spark, Programming, Public Speaking, Research, PowerPoint",Master of Science - MS,University of Illinois Urbana-Champaign,"edX Honor Code Certificate for Scalable Machine Learning, edX Honor Code Certificate for Introduction to Big Data with Apache Spark",Bengaluru,Karnataka,India,ml_engineer
Software Engineer,Stripe,4.7,"Data Structures and Algorithms, CUDA, GPU Computing, Software Engineering, Natural Language Processing (NLP), Artificial Intelligence (AI), MLOps, Deep Learning, Computer Vision, Machine Learning, Python, PyTorch, TensorFlow, Matlab, C++, Git, Reinforcement Learning, Geometric Deep Learning",Master of Technology - MTech,"Indian Institute of Technology, Kanpur",,Bengaluru,Karnataka,India,ml_engineer
